keyword,ngram,pattern,start,end,phrase_length
excuse herself in visible trepidation paul,6,VNPANN,54235,54240,6
herself in visible trepidation paul laughed quietly,7,NPANNVM,54236,54242,7
visible trepidation paul laughed quietly to himself,7,ANNVMPN,54238,54244,7
himself then turned sober and said poor psyche,8,NMVMCVAN,54244,54251,8
said poor psyche with a sympathetic sigh he,8,VANPDANN,54249,54256,8
poor psyche with a sympathetic sigh he roamed,8,ANPDANNV,54250,54257,8
sympathetic sigh he roamed about the room,7,ANNVPDN,54254,54260,7
sound of voices drew him to the window,8,NPNVNPDN,54264,54271,8
him to the window to behold the girl,8,NPDNMVDN,54268,54275,8
girl coming up the walk with her,7,NVPDNPN,54275,54281,7
walk with her tired old father leaning,7,NPNAANV,54279,54285,7
baskets and bundles and her hands occupied,7,NCNCNNV,54293,54299,7
we are cried a cheery voice as they,8,NVVDNNCN,54306,54313,8
cheery voice as they entered without observing,7,NNCNVCV,54310,54316,7
they entered without observing the new comer i,8,NVCVDANN,54313,54320,8
new comer i ve done all my errands,8,ANNVVDNN,54318,54325,8
had a lovely time there,5,VDANN,54327,54331,5
lovely time there is tom,5,ANNVN,54329,54333,5
famous turtles for harry here are your bundles,8,ANPNMVNN,54345,54352,8
good rest before dinner i went,6,ANPNNV,54367,54372,6
rest before dinner i went to the mill,8,NPNNVPDN,54368,54375,8
got him psyche,3,VNN,54377,54379,3
him psyche spoke,3,NNV,54378,54380,3
she had brought a treasure,5,NVVDN,54383,54387,5
she had,2,NV,54390,54391,2
face usually was about as,5,NMVMM,54397,54401,5
it woke and warmed with the affection which,8,NVCVPDNN,54407,54414,8
woke and warmed with the affection which his,8,VCVPDNNN,54408,54415,8
warmed with the affection which his daughter,7,VPDNNNN,54410,54416,7
affection which his daughter had fostered,6,NNNNVV,54413,54418,6
which his daughter had fostered till no amount,8,NNNVVPDN,54414,54421,8
daughter had fostered till no amount of flannel,8,NVVPDNPN,54416,54423,8
amount of flannel could extinguish it his,7,NPNVVNN,54421,54427,7
flannel could extinguish it his big hand,7,NVVNNAN,54423,54429,7
it his big hand patted her cheek,7,NNANVNN,54426,54432,7
he said in a tone of fatherly love,8,NVPDNPAN,54436,54443,8
pride my little sy,4,VNAN,54445,54448,4
my little sy never forgets old father,7,NANMVAN,54446,54452,7
old father does she good gracious me my,8,ANVNAANN,54451,54458,8
does she good gracious me my dear there,8,VNAANNAN,54453,54460,8
she good gracious me my dear there s,8,NAANNANV,54454,54461,8
me my dear there s such a mess,8,NNANVDDN,54457,54464,8
there s such a mess in the kitchen,8,NVDDNPDN,54460,54467,8
s such a mess in the kitchen katy,8,VDDNPDNN,54461,54468,8
mess in the kitchen katy s burnt,7,NPDNNMV,54464,54470,7
kitchen katy s burnt up the pudding,7,NNMVPDN,54467,54473,7
pudding put castor oil,4,NVNN,54473,54476,4
salad smashed the best meat dish,6,NVDANN,54482,54487,6
mr gage come to dinner,5,ANVPN,54491,54495,5
dinner cried mrs,3,NVN,54495,54497,3
accents of despair as she tied up her,8,NPNCNVPN,54500,54507,8
despair as she tied up her head,7,NCNVPNN,54502,54508,7
tied up her head in a fourth shawl,8,VPNNPDAN,54505,54512,8
i m so glad i,5,NVMAN,54514,54518,5
glad i ll go in and see him,8,ANVVMCVN,54517,54524,8
i ll come and attend to everything,7,NVVCVPN,54530,54536,7
everything so do n't worry mother,6,NMVMVN,54536,54541,6
mother how did you,4,NMVN,54541,54544,4
you find me,3,NVN,54544,54546,3
me out asked psyche as she,6,NPVNCN,54546,54551,6
psyche as she shook hands with her guest,8,NCNVNPNN,54549,54556,8
stood looking up at him,5,VVPPN,54558,54562,5
violets showed me,3,NVN,54575,54577,3
way she glanced at the posy in his,8,NNVPDNPN,54579,54586,8
she glanced at the posy in his button,8,NVPDNPNN,54580,54587,8
glanced at the posy in his button hole,8,VPDNPNNN,54581,54588,8
i gave them to adam but i,7,NVNPNCN,54592,54598,7
them to adam but i did n't think,8,NPNCNVMV,54594,54601,8
adam but i did n't think you,7,NCNVMVN,54596,54602,7
you would guess i,4,NVVN,54602,54605,4
i enjoyed your work for an hour,7,NVNNPDN,54605,54611,7
enjoyed your work for an hour to day,8,VNNPDNPN,54606,54613,8
hour to day and i have no words,8,NPNCNVDN,54611,54618,8
to express my admiration there,5,MVNNN,54621,54625,5
my admiration there is no need,6,NNNVDN,54623,54628,6
tell me about yourself what,5,VNPNN,54631,54635,5
me about yourself what have you,6,NPNNVN,54632,54637,6
you been doing all this year he,7,NVVDDNN,54637,54643,7
year he asked watching with genuine satisfaction,7,NNVVPNN,54642,54648,7
him for discontent anxiety and sadness were no,8,NPNNCNVM,54655,54662,8
discontent anxiety and sadness were no longer,7,NNCNVMM,54657,54663,7
i ve been working and waiting she,7,NVVVCVN,54666,54672,7
she began and succeeding,4,NVCV,54672,54675,4
i may believe what i,5,NVVNN,54677,54681,5
what i see and hear and read he,8,NNVCVCVN,54680,54687,8
he said with an expressive little wave,7,NVPDAAN,54687,54693,7
little wave of the book as he laid,8,ANPDNCNV,54692,54699,8
wave of the book as he laid it,8,NPDNCNVN,54693,54700,8
her my diary i did n't know i,8,NNANVMVN,54703,54710,8
i had lost it,4,NVVN,54710,54713,4
it where did you,4,NMVN,54713,54716,4
you find it by the brook,6,NVNPDN,54716,54721,6
i stopped to rest the moment i,7,NVMVDNN,54723,54729,7
moment i saw your name i,6,NNVNNN,54728,54733,6
your name i shut it up forgive me,8,NNNVNPAN,54731,54738,8
i shut it up forgive me but i,8,NVNPANCN,54733,54740,8
it up forgive me but i ca n't,8,NPANCNVM,54735,54742,8
forgive me but i ca n't ask pardon,8,ANCNVMVN,54737,54744,8
reading a few pages of that little gospel,8,VDANPDAN,54746,54753,8
patience love and self denial she gave him,8,NNCNNNVN,54755,54762,8
hurried the telltale book out of sight,7,VDNNPPN,54767,54773,7
telltale book out of sight as she said,8,NNPPNCNV,54769,54776,8
sight as she said with a momentary shadow,8,NCNVPDNN,54773,54780,8
she said with a momentary shadow on her,8,NVPDNNPN,54775,54782,8
said with a momentary shadow on her face,8,VPDNNPNN,54776,54783,8
momentary shadow on her face it has been,8,NNPNNNVV,54779,54786,8
her face it has been a hard task,8,NNNVVDAN,54782,54789,8
it has been a hard task but i,8,NVVDANCN,54784,54791,8
hard task but i think i,6,ANCNVN,54788,54793,6
i have learned it,4,NVVN,54793,54796,4
my dream is a noonday light and truth,8,NNVDNNCN,54804,54811,8
is a noonday light and truth to me,8,VDNNCNPN,54806,54813,8
you do not relinquish your hopes,6,NVMVNN,54815,54820,6
lay down your tools he,5,VPNNN,54822,54826,5
your tools he asked with some eagerness,7,NNNVPDN,54824,54830,7
i thought at first,4,NVMM,54832,54835,4
i could not serve two masters,6,NVMVAN,54837,54842,6
one i find i,4,ANVN,54850,54853,4
i am,2,NV,54853,54854,2
other my cares and duties are growing,7,ANNCNVV,54860,54866,7
day or i have learned to bear them,8,NCNVVMVN,54869,54876,8
my leisure does come i,5,NNVVN,54880,54884,5
i shall know how to use it,7,NVVMMVN,54884,54890,7
shall know how to use it for my,8,VVMMVNPN,54885,54892,8
know how to use it for my head,8,VMMVNPNN,54886,54893,8
it for my head is,5,NPNNV,54890,54894,5
ambitious plans and i feel,5,ANCNV,54897,54901,5
i can do something,4,NVVN,54903,54906,4
her eyes and a sense of power betrayed,8,NNCDNPNV,54914,54921,8
eyes and a sense of power betrayed itself,8,NCDNPNVN,54915,54922,8
sense of power betrayed itself in voice,7,NPNVNPN,54918,54924,7
power betrayed itself in voice and gesture,7,NVNPNCN,54920,54926,7
betrayed itself in voice and gesture as she,8,VNPNCNCN,54921,54928,8
itself in voice and gesture as she spoke,8,NPNCNCNV,54922,54929,8
voice and gesture as she spoke i,7,NCNCNVN,54924,54930,7
i believe it he,4,NVNN,54930,54933,4
it he said heartily you,5,NNVMN,54932,54936,5
you have learned the secret as that,7,NVVDNCN,54936,54942,7
secret as that proves psyche,5,NCNVN,54940,54944,5
psyche looked at the childish image,6,NVPDAN,54944,54949,6
childish image as he pointed to it,7,ANCNVPN,54948,54954,7
her face there came a motherly expression that,8,NNMVDANN,54957,54964,8
motherly expression that made it,5,ANNVN,54962,54966,5
sweet that little sister was so,6,ACANVM,54968,54973,6
me i could not fail to make her,8,NNVMVMVN,54976,54983,8
i put my heart into my work,7,NVNNPNN,54986,54992,7
year has gone,3,NVV,54994,54996,3
i do n't regret it though this,7,NVMVNCN,54998,55004,7
it though this is all i,6,NCNVDN,55002,55007,6
i have done you,4,NVVN,55007,55010,4
you forget your three wishes i,6,NVNANN,55010,55015,6
your three wishes i think the year,7,NANNVDN,55012,55018,7
year has granted them what,5,NVVNN,55018,55022,5
them what were they,4,NNVN,55021,55024,4
they to possess beauty in yourself,6,NMVNPN,55024,55029,6
seeing it in all things and the art,8,VNPDNCDN,55033,55040,8
reproducing it with truth she,5,VNPNN,55042,55046,5
it with truth she colored deeply,6,NPNNVM,55043,55048,6
truth she colored deeply under the glance which,8,NNVMPDNN,55045,55052,8
glance which accompanied the threefold compliment,6,NNVDNN,55051,55056,6
answered with grateful humility you,5,VPANN,55058,55062,5
grateful humility you are very,5,ANNVM,55060,55064,5
to say so i,4,MVMN,55066,55069,4
i wish i,3,NVN,55069,55071,3
i could believe it,4,NVVN,55071,55074,4
to forget herself she,4,MVNN,55079,55082,4
herself she added rather abruptly i,6,NNVMMN,55081,55086,6
i hear you,3,NVN,55086,55088,3
you think of giving your adam,6,NVCVNN,55088,55093,6
mate have you,3,NVN,55095,55097,3
you begun,2,NV,55097,55098,2
my design is finished all but the face,8,NNVVDCDN,55101,55108,8
design is finished all but the face i,8,NVVDCDNN,55102,55109,8
face i should think you,5,NNVVN,55108,55112,5
you could image eve,4,NVVN,55112,55115,4
beauty since you have succeeded so well,7,NCNVVMM,55117,55123,7
you have succeeded so well with adam,7,NVVMMPN,55119,55125,7
expression that is the charm of feminine faces,8,NNVDNPAN,55133,55140,8
can catch and keep it i,6,VVCVNN,55147,55152,6
it i want,3,NNV,55151,55153,3
face one that shall be,5,NANVV,55157,55161,5
shadow of a grief that has softened,7,NPDNNVV,55187,55193,7
grief that has softened but not saddened it,8,NNVVCMVN,55190,55197,8
that has softened but not saddened it it,8,NVVCMVNN,55191,55198,8
it it will be,4,NNVV,55197,55200,4
to find a face,4,MVDN,55202,55205,4
i do n't expect to find it,7,NVMVMVN,55208,55214,7
do n't expect to find it in perfection,8,VMVMVNPN,55209,55216,8
sometimes sees faces which,4,MVNN,55219,55222,4
faces which suggest all this,5,NNVMN,55221,55225,5
rare moments give glimpses of a lovely possibility,8,ANVNPDAN,55228,55235,8
moments give glimpses of a lovely possibility i,8,NVNPDANN,55229,55236,8
glimpses of a lovely possibility i sincerely hope,8,NPDANNMV,55231,55238,8
lovely possibility i sincerely hope you,6,ANNMVN,55234,55239,6
you will find,3,NVV,55239,55241,3
then said psyche,3,MVN,55243,55245,3
psyche thinking of the dinner,5,NVPDN,55245,55249,5
dinner thank you i,4,NVNN,55249,55252,4
you i think i,4,NNVN,55251,55254,4
i have now in order that,6,NVMPNN,55254,55259,6
one may be suited we,5,NVVVN,55261,55265,5
we will stop here and leave our readers,8,NVVMCVNN,55265,55272,8
our readers to finish the story as they,8,NNMVDNCN,55271,55278,8
story as they like those who,6,NCNVNN,55276,55281,6
those who prefer the good old fashion,7,NNVDAAN,55280,55286,7
good old fashion may believe,5,AANVV,55284,55288,5
hero and heroine fell in love,6,NCNVPN,55291,55296,6
love were married and lived happily ever afterward,8,NVVCVMMM,55296,55303,8
those who can conceive of a world,7,NNVVPDN,55305,55311,7
conceive of a world outside of a wedding,8,VPDNPPDN,55308,55315,8
world outside of a wedding ring may believe,8,NPPDNNVV,55311,55318,8
friends remained faithful friends,4,NVAN,55321,55324,4
their lives while paul won fame and fortune,8,NNCNVNCN,55326,55333,8
paul won fame and fortune and psyche,7,NVNCNCN,55329,55335,7
fame and fortune and psyche grew,6,NCNCNV,55331,55336,6
duties which became pleasures,4,NNVN,55349,55352,4
art which made life,4,NNVN,55356,55359,4
brought rewards in time,4,VNPN,55366,55369,4
time of my end approaches i,6,NPNNVN,55371,55376,6
i have lately been,4,NVMV,55376,55379,4
ordinary course of things my physician tells me,8,ANPNNNVN,55389,55396,8
course of things my physician tells me i,8,NPNNNVNN,55390,55397,8
me i may fairly hope,5,NNVMV,55396,55400,5
my life will not be protracted many months,8,NNVMVVAN,55402,55409,8
i am cursed with an exceptional physical constitution,8,NVVPDAAN,55412,55419,8
exceptional physical constitution as i am cursed,7,AANCNVV,55417,55423,7
i am cursed with an exceptional mental character,8,NVVPDAAN,55421,55428,8
am cursed with an exceptional mental character i,8,VVPDAANN,55422,55429,8
exceptional mental character i shall not much longer,8,AANNVMMM,55426,55433,8
earthly existence if it were to be otherwise,8,ANCNVMVM,55441,55448,8
i were to live on to the age,8,NVMVPPDN,55451,55458,8
i should,2,NV,55466,55467,2
miseries of delusive expectation can outweigh the miseries,8,NPANVVDN,55474,55481,8
expectation can outweigh the miseries of true prevision,8,NVVDNPAN,55477,55484,8
outweigh the miseries of true prevision for i,8,VDNPANCN,55479,55486,8
miseries of true prevision for i foresee when,8,NPANCNVM,55481,55488,8
true prevision for i foresee when i,7,ANCNVMN,55483,55489,7
i shall die,3,NVV,55489,55491,3
everything that will happen in my last moments,8,NNVVPNAN,55493,55500,8
day on september 20 1850 i shall be,8,NPNAANVV,55506,55513,8
september 20 1850 i shall be sitting,7,NAANVVV,55508,55514,7
1850 i shall be sitting in this chair,8,ANVVVPDN,55510,55517,8
be sitting in this chair in this study,8,VVPDNPDN,55513,55520,8
study at ten o'clock at night longing to,8,NPANPNVM,55520,55527,8
ten o'clock at night longing to die weary,8,ANPNVMVN,55522,55529,8
night longing to die weary of incessant insight,8,NVMVNPAN,55525,55532,8
to die weary of incessant insight and foresight,8,MVNPANCN,55527,55534,8
i am watching a tongue of blue flame,8,NVVDNPAN,55542,55549,8
tongue of blue flame rising in the fire,8,NPANVPDN,55546,55553,8
fire and my lamp is burning low,7,NCNNVVM,55553,55559,7
my lamp is burning low the horrible contraction,8,NNVVMDAN,55555,55562,8
horrible contraction will begin at my chest i,8,ANVVPNNN,55561,55568,8
my chest i shall only have time,7,NNNVMVN,55566,55572,7
time to reach the bell,5,NMVDN,55572,55576,5
pull it,2,VN,55578,55579,2
sense of suffocation will come no one,7,NPNVVDN,55583,55589,7
one will answer my bell i,6,NVVNNN,55589,55594,6
my bell i know why my two servants,8,NNNVMNAN,55592,55599,8
my two servants are lovers,5,NANVN,55597,55601,5
will have quarrelled my housekeeper,5,VVVNN,55603,55607,5
my housekeeper will have rushed,5,NNVVV,55606,55610,5
housekeeper will have rushed out of the house,8,NVVVPPDN,55607,55614,8
rushed out of the house in a fury,8,VPPDNPDN,55610,55617,8
hoping that perry,3,VDN,55621,55623,3
perry will believe she,4,NVVN,55623,55626,4
she has gone to drown herself perry,7,NVVMVNN,55626,55632,7
herself perry is alarmed,4,NNVV,55631,55634,4
is gone out after her,5,VVPPN,55638,55642,5
little scullery maid is,4,ANNV,55644,55647,4
bench she never answers the bell it,7,NNMVDNN,55651,55657,7
bell it does not wake her,6,NNVMVN,55656,55661,6
sense of suffocation increases my lamp goes out,8,NPNNNNVM,55663,55670,8
my lamp goes out with a horrible stench,8,NNVMPDAN,55667,55674,8
lamp goes out with a horrible stench i,8,NVMPDANN,55668,55675,8
horrible stench i make a great effort,7,ANNVDAN,55673,55679,7
stench i make a great effort and snatch,8,NNVDANCN,55674,55681,8
life and there is no help i,7,NCNVDNN,55689,55695,7
help i thirsted,3,NNV,55694,55696,3
thirst is gone o god,5,NVVPN,55701,55705,5
god let me,3,NVN,55705,55707,3
me stay,2,NV,55707,55708,2
it i am content agony of pain,7,NNVANPN,55716,55722,7
i am content agony of pain and suffocation,8,NVANPNCN,55717,55724,8
light of the morning through my chamber window,8,NPDNPNNV,55750,55757,8
morning through my chamber window the warmth,7,NPNNVDN,55753,55759,7
my chamber window the warmth of the hearth,8,NNVDNPDN,55755,55762,8
will darkness,2,VN,55768,55769,2
nothing but darkness but i am passing on,8,NPNCNVVM,55782,55789,8
darkness but i am passing on and on,8,NCNVVMCM,55784,55791,8
am passing on and on through the darkness,8,VVMCMPDN,55787,55794,8
passing on and on through the darkness my,8,VMCMPDNN,55788,55795,8
darkness my thought stays in the darkness,7,NNVNPDN,55794,55800,7
moving onward before that time,5,VMPDN,55807,55811,5
time comes i,3,NVN,55811,55813,3
i wish to use my last hours,7,NVMVNAN,55813,55819,7
wish to use my last hours of ease,8,VMVNANPN,55814,55821,8
use my last hours of ease and strength,8,VNANPNCN,55816,55823,8
telling the strange story of my experience i,8,VDANPNNN,55825,55832,8
strange story of my experience i have never,8,ANPNNNVM,55827,55834,8
story of my experience i have never fully,8,NPNNNVMM,55828,55835,8
my experience i have never fully unbosomed myself,8,NNNVMMAN,55830,55837,8
unbosomed myself to any human being i have,8,ANPDANNV,55836,55843,8
myself to any human being i have never,8,NPDANNVM,55837,55844,8
human being i have never been encouraged to,8,ANNVMVVM,55840,55847,8
being i have never been encouraged to trust,8,NNVMVVMV,55841,55848,8
i have never been encouraged to trust much,8,NVMVVMVM,55842,55849,8
been encouraged to trust much in the sympathy,8,VVMVMPDN,55845,55852,8
to trust much in the sympathy of my,8,MVMPDNPN,55847,55854,8
sympathy of my fellow men but we have,8,NPNANCNV,55852,55859,8
fellow men but we have all a chance,8,ANCNVDDN,55855,55862,8
we have all a chance of meeting,7,NVDDNPN,55858,55864,7
we are dead it,4,NVAN,55873,55876,4
dead it is the living,5,ANVDN,55875,55879,5
who can not be forgiven,5,NVMVV,55881,55885,5
indulgence and reverence are held,5,NCNVV,55894,55898,5
reverence are held off like the rain,7,NVVPPDN,55896,55902,7
hard east wind while the heart beats bruise,8,AANCDNNV,55905,55912,8
east wind while the heart beats bruise it,8,ANCDNNVN,55906,55913,8
it is your only opportunity while the eye,8,NVNANCDN,55915,55922,8
your only opportunity while the eye can still,8,NANCDNVM,55917,55924,8
only opportunity while the eye can still turn,8,ANCDNVMV,55918,55925,8
eye can still turn towards you with moist,8,NVMVPNPN,55922,55929,8
can still turn towards you with moist timid,8,VMVPNPNN,55923,55930,8
still turn towards you with moist timid entreaty,8,MVPNPNNN,55924,55931,8
you with moist timid entreaty freeze it,7,NPNNNVN,55927,55933,7
timid entreaty freeze it with an icy unanswering,8,NNVNPDAN,55930,55937,8
it with an icy unanswering gaze,6,NPDANV,55933,55938,6
inmost sanctuary of the soul can still take,8,ANPDNVMV,55947,55954,8
soul can still take in the tones,7,NVMVPDN,55951,55957,7
can still take in the tones of kindness,8,VMVPDNPN,55952,55959,8
tones of kindness put it,5,NPNVN,55957,55961,5
kindness put it off with hard civility,7,NVNPPAN,55959,55965,7
put it off with hard civility or sneering,8,VNPPANCN,55960,55967,8
affectation of indifference while the creative brain can,8,NPNCDANV,55971,55978,8
indifference while the creative brain can still throb,8,NCDANVMV,55973,55980,8
creative brain can still throb with the sense,8,ANVMVPDN,55976,55983,8
can still throb with the sense of injustice,8,VMVPDNPN,55978,55985,8
make haste,2,VN,55993,55994,2
oppress it with your ill,5,VNPNN,55996,56000,5
it with your ill considered judgements your,7,NPNNVNN,55997,56003,7
your ill considered judgements your trivial comparisons your,8,NNVNNANN,55999,56006,8
considered judgements your trivial comparisons your careless misrepresentations,8,VNNANNAN,56001,56008,8
heart will by and by be,6,NVPCPN,56010,56015,6
eye will cease to entreat the ear,7,NVVMVDN,56028,56034,7
ear will be deaf the brain,6,NVVVDN,56034,56039,6
brain will have ceased from all wants,7,NVVVPDN,56039,56045,7
your charitable speeches may find,5,NANVV,56053,56057,5
you may remember and pity the toil,7,NVVCVDN,56060,56066,7
remember and pity the toil and the struggle,8,VCVDNCDN,56062,56069,8
you may give due honour to the work,8,NVVPNPDN,56074,56081,8
honour to the work achieved then you,7,NPDNVMN,56078,56084,7
you may find extenuation for errors,6,NVVNPN,56084,56089,6
may consent to bury them that,6,VVMVNN,56091,56096,6
them that is a trivial schoolboy text,7,NNVDANN,56095,56101,7
trivial schoolboy text why do i,6,ANNMVN,56099,56104,6
i dwell on it it,5,NVPNN,56104,56108,5
it it has little reference to me,7,NNVANPN,56107,56113,7
it has little reference to me for i,8,NVANPNCN,56108,56115,8
little reference to me for i shall leave,8,ANPNCNVV,56110,56117,8
me for i shall leave no works,7,NCNVVDN,56113,56119,7
i shall leave no works behind me,7,NVVDNPN,56115,56121,7
shall leave no works behind me for men,8,VVDNPNPN,56116,56123,8
works behind me for men to honour i,8,NPNPNMVN,56119,56126,8
i have no near relatives who,6,NVDANN,56126,56131,6
near relatives who will make,5,ANNVV,56129,56133,5
weeping over my grave for the wounds they,8,VPNNPDNN,56136,56143,8
my grave for the wounds they inflicted,7,NNPDNNV,56138,56144,7
grave for the wounds they inflicted on me,8,NPDNNVPN,56139,56146,8
i was among them it,5,NVPNN,56148,56152,5
them it is only the story of my,8,NNVMDNPN,56151,56158,8
it is only the story of my life,8,NVMDNPNN,56152,56159,8
is only the story of my life that,8,VMDNPNNN,56153,56160,8
story of my life that will perhaps win,8,NPNNNVMV,56156,56163,8
that will perhaps win a little more sympathy,8,NVMVDAAN,56160,56167,8
perhaps win a little more sympathy from strangers,8,MVDAANPN,56162,56169,8
i am,2,NV,56171,56172,2
i ever believed it,4,NMVN,56175,56178,4
it would obtain from my friends,6,NVVPNN,56178,56183,6
my friends while i was living my childhood,8,NNCNVVNN,56182,56189,8
my childhood perhaps seems,4,NNMV,56188,56191,4
me than it really was by contrast,7,NCNMVPN,56194,56200,7
curtain of the future was as,6,NPDNVM,56209,56214,6
me as to other children i had,7,NPPANNV,56217,56223,7
other children i had all their delight,7,ANNVDNN,56220,56226,7
had all their delight in the present hour,8,VDNNPDAN,56223,56230,8
indefinite hopes for the morrow and i had,8,ANPDNCNV,56233,56240,8
morrow and i had a tender mother,7,NCNVDNN,56237,56243,7
remembrance of her caress as she held me,8,NPNNCNVN,56260,56267,8
her caress as she held me on her,8,NNCNVNPN,56262,56269,8
caress as she held me on her knee,8,NCNVNPNN,56263,56270,8
arms round my little body her cheek pressed,8,NPNANNNV,56273,56280,8
my little body her cheek pressed on mine,8,NANNNVPN,56275,56282,8
little body her cheek pressed on mine i,8,ANNNVPNN,56276,56283,8
mine i had a complaint of the eyes,8,NNVDNPDN,56282,56289,8
i had a complaint of the eyes that,8,NVDNPDNN,56283,56290,8
complaint of the eyes that made me,7,NPDNNVN,56286,56292,7
little while and she kept me on her,8,ANCNVNPN,56296,56303,8
while and she kept me on her knee,8,NCNVNPNN,56297,56304,8
she kept me on her knee from morning,8,NVNPNNPN,56299,56306,8
her knee from morning till night that unequalled,8,NNPNPNNV,56303,56310,8
knee from morning till night that unequalled love,8,NPNPNNVN,56304,56311,8
love soon vanished out of my life,7,NMVPPNN,56311,56317,7
my childish consciousness it was,5,NANNV,56321,56325,5
life had become more chill i,6,NVVANN,56329,56334,6
more chill i rode my little white pony,8,ANNVNAAN,56332,56339,8
rode my little white pony with the groom,8,VNAANPDN,56335,56342,8
there were no loving eyes,5,NVDAN,56349,56353,5
loving eyes looking at me,5,ANVPN,56352,56356,5
me as i mounted no glad arms,7,NCNVDAN,56356,56362,7
glad arms opened to me,5,ANVPN,56361,56365,5
i came back perhaps i,5,NVMMN,56367,56371,5
i missed my mother,4,NVNN,56371,56374,4
would have done to whom the other pleasures,8,VVVMVDAN,56385,56392,8
done to whom the other pleasures of life,8,VMVDANPN,56387,56394,8
other pleasures of life remained as,6,ANPNVM,56391,56396,6
i was certainly,3,NVM,56399,56401,3
sensitive child i remember still the mingled trepidation,8,ANNVMDAN,56404,56411,8
remember still the mingled trepidation and delicious excitement,8,VMDANCAN,56407,56414,8
trepidation and delicious excitement with which i was,8,NCANPNNV,56411,56418,8
delicious excitement with which i was affected,7,ANPNNVV,56413,56419,7
which i was affected by the tramping,7,NNVVPDN,56416,56422,7
was affected by the tramping of the horses,8,VVPDNPDN,56418,56425,8
carriage thundered under the archway of the courtyard,8,NVPDNPDN,56453,56460,8
din of the gong as it gave notice,8,NPDNCNVN,56463,56470,8
gong as it gave notice of luncheon,7,NCNVNPN,56466,56472,7
it gave notice of luncheon and dinner,7,NVNPNCN,56468,56474,7
measured tramp of soldiery which i,6,VNPNNN,56476,56481,6
tramp of soldiery which i sometimes heard,7,NPNNNMV,56477,56483,7
house lay near a county town,6,NVPDNN,56489,56494,6
there were large barracks,4,NVAN,56496,56499,4
made me,2,VN,56501,56502,2
they were gone past i,5,NVVAN,56509,56513,5
past i longed,3,ANV,56512,56514,3
them to come back again i,6,NMVMMN,56516,56521,6
i fancy my father,4,NVNN,56521,56524,4
my father thought me,4,NNVN,56523,56526,4
had little fondness for me though he,7,VANPNCN,56531,56537,7
little fondness for me though he was very,8,ANPNCNVM,56532,56539,8
fulfilling what he,3,VNN,56542,56544,3
what he regarded as a parent,6,NNVPDN,56543,56548,6
duties but he was already past the middle,8,NCNVMPDN,56550,56557,8
he was already past the middle of life,8,NVMPDNPN,56552,56559,8
middle of life and i was not his,8,NPNCNVMN,56557,56564,8
life and i was not his only son,8,NCNVMNAN,56559,56566,8
i was not his only son my mother,8,NVMNANNN,56561,56568,8
his only son my mother had been his,8,NANNNVVN,56564,56571,8
son my mother had been his second wife,8,NNNVVNAN,56566,56573,8
mother had been his second wife and he,8,NVVNANCN,56568,56575,8
his second wife and he was,6,NANCNV,56571,56576,6
he married her he,4,NVNN,56581,56584,4
her he was a firm,5,NNVDN,56583,56587,5
