keyword,ngram,pattern,start,end,phrase_length
day of my death i have had,7,NPNNNVV,18419,18425,7
my death i have had some awkward,7,NNNVVDN,18421,18427,7
awkward travelling adventures in my time,6,NVNPNN,18427,18432,6
travelling adventures in my time but that adventure,8,VNPNNCDN,18428,18435,8
my time but that adventure well never mind,8,NNCDNMMV,18431,18438,8
time but that adventure well never mind suppose,8,NCDNMMVN,18432,18439,8
adventure well never mind suppose we,6,NMMVNN,18435,18440,6
suppose we begin the sitting i,6,NNVDNN,18439,18444,6
sitting i make,3,NNV,18443,18445,3
giving me,2,VN,18454,18455,2
thus wasting your time in mere talk,7,MVNNPAN,18459,18465,7
your time in mere talk come come thought,8,NNPANVVV,18461,18468,8
time in mere talk come come thought i,8,NPANVVVN,18462,18469,8
mere talk come come thought i as he,8,ANVVVNCN,18464,18471,8
i as he went back to the sitter,8,NCNVMPDN,18469,18476,8
chair i shall see your natural expression,7,NNVVNAN,18478,18484,7
i shall see your natural expression on your,8,NVVNANPN,18479,18486,8
shall see your natural expression on your face,8,VVNANPNN,18480,18487,8
natural expression on your face if i can,8,ANPNNCNV,18483,18490,8
expression on your face if i can only,8,NPNNCNVM,18484,18491,8
your face if i can only get you,8,NNCNVMVN,18486,18493,8
you to talk about that adventure it,7,NMVPDNN,18493,18499,7
adventure it was,3,NNV,18498,18500,3
enough to lead him in the right direction,8,MMVNPDAN,18502,18509,8
first hint from me he returned,6,ANPNNV,18512,18517,6
hint from me he returned to the subject,8,NPNNVPDN,18513,18520,8
he returned to the subject of the house,8,NVPDNPDN,18516,18523,8
house in the back street without i hope,8,NPDANCNV,18523,18530,8
back street without i hope showing,6,ANCNVV,18526,18531,6
street without i hope showing any undue curiosity,8,NCNVVDAN,18527,18534,8
i hope showing any undue curiosity i,7,NVVDANN,18529,18535,7
undue curiosity i contrived to let him,7,ANNVMVN,18533,18539,7
him see,2,NV,18539,18540,2
i felt a deep interest in everything he,8,NVDANPNN,18542,18549,8
deep interest in everything he now said,7,ANPNNMV,18545,18551,7
now said after two or three preliminary hesitations,8,MVPACAAN,18550,18557,8
said after two or three preliminary hesitations he,8,VPACAANN,18551,18558,8
my great joy fairly started on the narrative,8,NANMVPDN,18562,18569,8
joy fairly started on the narrative of his,8,NMVPDNPN,18564,18571,8
fairly started on the narrative of his adventure,8,MVPDNPNN,18565,18572,8
interest of his subject he soon completely forgot,8,NPNNNMMV,18575,18582,8
he was sitting for his portrait,6,NVVPNN,18584,18589,6
very expression that i wanted came over his,8,ANNNVVPN,18591,18598,8
expression that i wanted came over his face,8,NNNVVPNN,18592,18599,8
his face and my drawing proceeded toward completion,8,NNCNNVPN,18598,18605,8
drawing proceeded toward completion in the right direction,8,NVPNPDAN,18602,18609,8
best purpose at every fresh touch i felt,8,ANPDANNV,18613,18620,8
purpose at every fresh touch i felt more,8,NPDANNVM,18614,18621,8
fresh touch i felt more and more,7,ANNVMCM,18617,18623,7
i was now getting,4,NVMV,18626,18629,4
my grand difficulty and i enjoyed,6,NANCNV,18633,18638,6
grand difficulty and i enjoyed the additional gratification,8,ANCNVDAN,18634,18641,8
having my work,3,VNN,18643,18645,3
my work lightened by the recital,6,NNVPDN,18644,18649,6
lightened by the recital of a true story,8,VPDNPDAN,18646,18653,8
recital of a true story which possessed,7,NPDANNV,18649,18655,7
true story which possessed in my estimation,7,ANNVPNN,18652,18658,7
exciting romance this as i recollect it,7,ANNCNVN,18665,18671,7
it is how mr faulkner,5,NVMAN,18671,18675,5
mr faulkner told me his adventure,6,ANVNNN,18674,18679,6
my education at college was finished i,7,NNPNVAN,18691,18697,7
finished i happened to be staying at paris,8,ANVMVVPN,18696,18703,8
be staying at paris with an english friend,8,VVPNPDAN,18700,18707,8
staying at paris with an english friend we,8,VPNPDANN,18701,18708,8
paris with an english friend we were both,8,NPDANNVM,18703,18710,8
english friend we were both young men,7,ANNVMAN,18706,18712,7
lived i,2,VN,18715,18716,2
i am,2,NV,18716,18717,2
city of our sojourn one night we were,8,NPNNANNV,18726,18733,8
our sojourn one night we were idling,7,NNANNVV,18728,18734,7
one night we were idling about the neighbourhood,8,ANNVVPDN,18730,18737,8
were idling about the neighbourhood of the palais,8,VVPDNPDN,18733,18740,8
amusement we should next betake ourselves my friend,8,NNVMVNNN,18745,18752,8
ourselves my friend proposed a visit to frascati,8,NNNVDNPN,18750,18757,8
his suggestion was not to my taste i,8,NNVMPNNN,18760,18767,8
my taste i knew frascati,5,NNNVN,18765,18769,5
french saying is by heart,5,NVVPN,18773,18777,5
heart had lost and won plenty,6,NVVCVN,18777,18782,6
lost and won plenty of five franc pieces,8,VCVNPAAN,18779,18786,8
sake until it was amusement,5,NCNVN,18792,18796,5
sake said i to my friend,6,NVNPNN,18823,18828,6
i to my friend let us,6,NPNNVN,18825,18830,6
us go somewhere where we,5,NVMMN,18830,18834,5
we can see a little genuine blackguard poverty,8,NVVDAANN,18834,18841,8
gaming with no false gingerbread glitter,6,VPDANN,18843,18848,6
false gingerbread glitter thrown over it,6,ANNVMN,18846,18851,6
it all let us,4,NVVN,18851,18854,4
us get away from fashionable frascati,6,NVMPAN,18854,18859,6
they do n't mind letting in a man,8,NVMVVPDN,18865,18872,8
ragged coat or a man with no coat,8,VNCDNPDN,18875,18882,8
coat or a man with no coat ragged,8,NCDNPDNV,18876,18883,8
coat ragged or otherwise very well said my,8,NVCMMMVN,18882,18889,8
ragged or otherwise very well said my friend,8,VCMMMVNN,18883,18890,8
otherwise very well said my friend we,7,MMMVNNN,18885,18891,7
my friend we need n't go,6,NNNVMV,18889,18894,6
we need n't go out of the palais,8,NVMVPPDN,18891,18898,8
to find the sort of company you,7,MVDNPNN,18900,18906,7
sort of company you want here s,7,NPNNVMV,18903,18909,7
company you want here s the place,7,NNVMVDN,18905,18911,7
blackguard a place by all report as you,8,VDNPDNCN,18916,18923,8
place by all report as you could possibly,8,NPDNCNVM,18918,18925,8
report as you could possibly wish to see,8,NCNVMVMV,18921,18928,8
could possibly wish to see in another minute,8,VMVMVPDN,18924,18931,8
possibly wish to see in another minute we,8,MVMVPDNN,18925,18932,8
minute we arrived at the door,6,NNVPDN,18931,18936,6
entered the house,3,VDN,18938,18940,3
back of which you have drawn in your,8,NPNNVVPN,18942,18949,8
which you have drawn in your sketch,7,NNVVPNN,18944,18950,7
we got upstairs and had left our hats,8,NVMCVVNN,18952,18959,8
had left our hats and sticks,6,VVNNCN,18956,18961,6
left our hats and sticks with the doorkeeper,8,VNNCNPDN,18957,18964,8
hats and sticks with the doorkeeper we were,8,NCNPDNNV,18959,18966,8
sticks with the doorkeeper we were admitted,7,NPDNNVV,18961,18967,7
doorkeeper we were admitted into the chief gambling,8,NNVVPDAN,18964,18971,8
we were admitted into the chief gambling room,8,NVVPDANN,18965,18972,8
were admitted into the chief gambling room we,8,VVPDANNN,18966,18973,8
chief gambling room we did not find,7,ANNNVMV,18970,18976,7
gambling room we did not find many people,8,NNNVMVAN,18971,18978,8
many people assembled there,4,ANVM,18977,18980,4
men were who,3,NVN,18985,18987,3
who looked up at us on our entrance,8,NVPPNPNN,18987,18994,8
looked up at us on our entrance they,8,VPPNPNNN,18988,18995,8
us on our entrance they were all types,8,NPNNNVDN,18991,18998,8
true types of their respective classes we had,8,ANPNANNV,19000,19007,8
types of their respective classes we had come,8,NPNANNVV,19001,19008,8
their respective classes we had come to see,8,NANNVVMV,19003,19010,8
respective classes we had come to see blackguards,8,ANNVVMVN,19004,19011,8
had come to see blackguards but these men,8,VVMVNCDN,19007,19014,8
blackguards but these men were something worse there,8,NCDNVNAN,19011,19018,8
something worse there is a comic side,7,NANVDAN,19016,19022,7
there was nothing but tragedy,5,NVNCN,19031,19035,5
nothing but tragedy mute weird tragedy,6,NCNVAN,19033,19038,6
quiet in the room was,5,NPDNV,19040,19044,5
thin haggard long haired young man whose,7,ANMVANN,19047,19053,7
young man whose sunken eyes,5,ANNVN,19051,19055,5
eyes fiercely watched,3,NMV,19055,19057,3
turning up of the cards,5,VNPDN,19059,19063,5
up of the cards never spoke,6,NPDNMV,19060,19065,6
cards never spoke the flabby fat,6,NMVDAN,19063,19068,6
flabby fat faced pimply player who,6,ANVMNN,19067,19072,6
player who pricked his piece of pasteboard,7,NNVNNPN,19071,19077,7
his piece of pasteboard perseveringly to register how,8,NNPNMMVM,19074,19081,8
piece of pasteboard perseveringly to register how often,8,NPNMMVMM,19075,19082,8
pasteboard perseveringly to register how often black won,8,NMMVMMAN,19077,19084,8
never spoke the dirty,4,MVDN,19089,19092,4
dirty wrinkled old man with the vulture eyes,8,NVANPDNN,19092,19099,8
eyes and the darned great coat who had,8,NCDAANNV,19099,19106,8
darned great coat who had lost his,7,AANNVVN,19102,19108,7
great coat who had lost his last sou,8,ANNVVNAN,19103,19110,8
he could play no longer never spoke even,8,NVVMMMVM,19117,19124,8
play no longer never spoke even the voice,8,VMMMVMDN,19119,19126,8
never spoke even the voice of the croupier,8,MVMDNPDN,19122,19129,8
voice of the croupier sounded,5,NPDNV,19126,19130,5
it were strangely dulled and thickened,6,NVMVCV,19133,19138,6
were strangely dulled and thickened in the atmosphere,8,VMVCVPDN,19134,19141,8
thickened in the atmosphere of the room i,8,VPDNPDNN,19138,19145,8
atmosphere of the room i had entered,7,NPDNNVV,19141,19147,7
room i had entered the place,6,NNVVDN,19144,19149,6
place to laugh,3,NMV,19149,19151,3
spectacle before me was something,5,NCNVN,19154,19158,5
something to weep over i,5,NMVPN,19158,19162,5
i soon found it,4,NMVN,19162,19165,4
to take refuge in excitement from the depression,8,MVNPNPDN,19167,19174,8
excitement from the depression of spirits which was,8,NPDNPNNV,19171,19178,8
stealing on me,3,VPN,19180,19182,3
i sought the nearest excitement,5,NVDAN,19184,19188,5
going to the table,4,VPDN,19190,19193,4
to play still more unfortunately as the event,8,MVMMMPDN,19196,19203,8
event will show i,4,NVVN,19203,19206,4
i won won,3,NVN,19206,19208,3
won prodigiously won incredibly,4,NMVM,19208,19211,4
regular players at the table crowded round me,8,ANPDNVPN,19219,19226,8
staring at my stakes with hungry superstitious eyes,8,VPNNPAAN,19228,19235,8
my stakes with hungry superstitious eyes whispered,7,NNPAANV,19230,19236,7
english stranger was going to break the bank,8,ANVVMVDN,19242,19249,8
game was,2,NV,19251,19252,2
i had played at it in every city,8,NVVPNPDN,19256,19263,8
played at it in every city in europe,8,VPNPDNPN,19258,19265,8
care or the wish to study the theory,8,NCDNMVDN,19269,19276,8
wish to study the theory of chances that,8,NMVDNPNN,19272,19279,8
to study the theory of chances that philosopher,8,MVDNPNNN,19273,19280,8
strict sense of the word i had never,8,ANPDNNVM,19291,19298,8
sense of the word i had never been,8,NPDNNVMV,19292,19299,8
word i had never been i,6,NNVMVN,19295,19300,6
i was heart,3,NVN,19300,19302,3
corroding passion for play my gaming,6,NNPVNN,19306,19311,6
my gaming was a mere idle amusement i,8,NNVDAANN,19310,19317,8
mere idle amusement i never resorted to it,8,AANNMVPN,19314,19321,8
amusement i never resorted to it by necessity,8,NNMVPNPN,19316,19323,8
it by necessity because i never knew what,8,NPNCNMVN,19321,19328,8
necessity because i never knew what it,7,NCNMVNN,19323,19329,7
what it was to want money i,7,NNVMVNN,19328,19334,7
money i never practised it,5,NNMVN,19333,19337,5
it so incessantly as to lose,6,NMMCMV,19337,19342,6
i could afford or to gain,6,NVVCMV,19345,19350,6
i could coolly pocket without being thrown,7,NVMVCVV,19353,19359,7
could coolly pocket without being thrown off my,8,VMVCVVPN,19354,19361,8
coolly pocket without being thrown off my balance,8,MVCVVPNN,19355,19362,8
being thrown off my balance by my,7,VVPNNPN,19358,19364,7
thrown off my balance by my good luck,8,VPNNPNAN,19359,19366,8
my good luck in short i had hitherto,8,NANPANVM,19364,19371,8
good luck in short i had hitherto frequented,8,ANPANVMV,19365,19372,8
luck in short i had hitherto frequented gambling,8,NPANVMVN,19366,19373,8
short i had hitherto frequented gambling tables,7,ANVMVNN,19368,19374,7
i frequented ball rooms and opera houses,7,NVNNCNN,19377,19383,7
frequented ball rooms and opera houses because they,8,VNNCNNCN,19378,19385,8
ball rooms and opera houses because they amused,8,NNCNNCNV,19379,19386,8
rooms and opera houses because they amused me,8,NCNNCNVN,19380,19387,8
i had nothing,3,NVN,19390,19392,3
to do with my leisure hours,6,MVPNNN,19394,19399,6
occasion it was very,4,NNVM,19403,19406,4
first time in my life i felt what,8,ANPNNNVN,19411,19418,8
passion for play really was my success,7,NPNMVNN,19420,19426,7
my success first bewildered,4,NNMV,19425,19428,4
literal meaning of the word intoxicated me,7,ANPDNVN,19434,19440,7
it may appear it,4,NVVN,19443,19446,4
it is nevertheless,3,NVM,19446,19448,3
i only lost when i,5,NMVMN,19451,19455,5
i attempted to estimate chances,5,NVMVN,19455,19459,5
played according to previous calculation,5,VVPAN,19461,19465,5
previous calculation if i left everything to luck,8,ANCNVNPN,19464,19471,8
staked without any care,4,VPDN,19473,19476,4
care or consideration i was,5,NCNNV,19476,19480,5
to win to win in the face,7,MVMVPDN,19482,19488,7
win in the face of every recognized probability,8,VPDNPDAN,19485,19492,8
ventured their money,3,VNN,19505,19507,3
my colour but i speedily increased my stakes,8,NNCNMVNN,19511,19518,8
i speedily increased my stakes to sums which,8,NMVNNPNN,19514,19521,8
speedily increased my stakes to sums which they,8,MVNNPNNN,19515,19522,8
my stakes to sums which they dared not,8,NNPNNNVM,19517,19524,8
stakes to sums which they dared not risk,8,NPNNNVMV,19518,19525,8
they left,2,NV,19529,19530,2
playing and breathlessly looked on at my game,8,VCMVPPNN,19532,19539,8
time after time i staked higher and higher,8,NPNNVMCM,19541,19548,8
time i staked higher and higher and still,8,NNVMCMCM,19543,19550,8
i staked higher and higher and still won,8,NVMCMCMV,19544,19551,8
higher and higher and still won the excitement,8,MCMCMVDN,19546,19553,8
still won the excitement in the room,7,MVDNPDN,19550,19556,7
excitement in the room rose to fever pitch,8,NPDNVMMV,19553,19560,8
room rose to fever pitch the silence,7,NVMMVDN,19556,19562,7
silence was interrupted,3,NVV,19562,19564,3
muttered chorus of oaths and exclamations,6,VNPNCN,19568,19573,6
gold was shovelled across to my side,7,NVVPPNN,19580,19586,7
shovelled across to my side of the table,8,VPPNNPDN,19582,19589,8
imperturbable croupier dashed his rake on the floor,8,ANVNNPDN,19592,19599,8
my success but one man present preserved his,8,NNCANNVN,19607,19614,8
success but one man present preserved his self,8,NCANNVNN,19608,19615,8
one man present preserved his self possession,7,ANNVNNN,19610,19616,7
present preserved his self possession and that man,8,NVNNNCDN,19612,19619,8
his self possession and that man was my,8,NNNCDNVN,19614,19621,8
self possession and that man was my friend,8,NNCDNVNN,19615,19622,8
possession and that man was my friend he,8,NCDNVNNN,19616,19623,8
my friend he came to my side,7,NNNVPNN,19621,19627,7
whispering in english,3,VPN,19629,19631,3
english begged me,3,NVN,19631,19633,3
me to leave the place,5,NMVDN,19633,19637,5
what i had already gained i,6,NNVMVN,19640,19645,6
i must do him,4,NVVN,19645,19648,4
justice to say,3,NMV,19650,19652,3
he repeated his warnings and entreaties several times,8,NVNNCNAN,19654,19661,8
only left me,3,MVN,19663,19665,3
i had rejected his advice i,6,NVVNNN,19670,19675,6
his advice i was to all intents,7,NNNVPDN,19673,19679,7
intents and purposes gambling,4,NCNV,19679,19682,4
terms which rendered it,4,NNVN,19685,19688,4
him to address me,4,NMVN,19691,19694,4
he had gone a hoarse voice behind me,8,NVVDNNPN,19700,19707,8
hoarse voice behind me cried permit me my,8,NNPNVNNN,19704,19711,8
me cried permit me my dear sir permit,8,NVNNNANN,19707,19714,8
cried permit me my dear sir permit me,8,VNNNANNN,19708,19715,8
me my dear sir permit me to restore,8,NNANNNMV,19710,19717,8
dear sir permit me to restore to their,8,ANNNMVPN,19712,19719,8
permit me to restore to their proper place,8,NNMVPNAN,19714,19721,8
to restore to their proper place two napoleons,8,MVPNANAN,19716,19723,8
restore to their proper place two napoleons which,8,VPNANANN,19717,19724,8
their proper place two napoleons which you have,8,NANANNNV,19719,19726,8
proper place two napoleons which you have dropped,8,ANANNNVV,19720,19727,8
two napoleons which you have dropped wonderful luck,8,ANNNVVAN,19722,19729,8
napoleons which you have dropped wonderful luck sir,8,NNNVVANN,19723,19730,8
which you have dropped wonderful luck sir i,8,NNVVANNN,19724,19731,8
wonderful luck sir i pledge you my word,8,ANNNVNNN,19728,19735,8
sir i pledge you my word of honour,8,NNVNNNPN,19730,19737,8
sort of thing i never saw such luck,8,NPNNMVAN,19751,19758,8
thing i never saw such luck as yours,8,NNMVANCN,19753,19760,8
such luck as yours never go on sir,8,ANCNMVPN,19757,19764,8
luck as yours never go on sir sacre,8,NCNMVPNN,19758,19765,8
yours never go on sir sacre mille bombes,8,NMVPNNNN,19760,19767,8
sir sacre mille bombes go,5,NNNNV,19764,19768,5
break the bank i,4,VDNN,19772,19775,4
bank i turned round and saw nodding,7,NNVMCVV,19774,19780,7
i turned round and saw nodding and smiling,8,NVMCVVCV,19775,19782,8
saw nodding and smiling at me,6,VVCVPN,19779,19784,6
nodding and smiling at me with inveterate civility,8,VCVPNPAN,19780,19787,8
tall man dressed,3,ANV,19789,19791,3
frogged and braided surtout if i,6,VCVNCN,19794,19799,6
surtout if i had been in my senses,8,NCNVVPNN,19797,19804,8
i had been in my senses i,7,NVVPNNN,19799,19805,7
my senses i should have considered him,7,NNNVVVN,19803,19809,7
being rather a suspicious specimen,5,VPDAN,19812,19816,5
suspicious specimen of an old soldier he had,8,ANPDANNV,19815,19822,8
specimen of an old soldier he had goggling,8,NPDANNVV,19816,19823,8
old soldier he had goggling bloodshot eyes,7,ANNVVNN,19819,19825,7
soldier he had goggling bloodshot eyes mangy moustaches,8,NNVVNNAN,19820,19827,8
goggling bloodshot eyes mangy moustaches and a broken,8,VNNANCDN,19823,19830,8
bloodshot eyes mangy moustaches and a broken nose,8,NNANCDNV,19824,19831,8
eyes mangy moustaches and a broken nose his,8,NANCDNVN,19825,19832,8
mangy moustaches and a broken nose his voice,8,ANCDNVNN,19826,19833,8
his voice betrayed a barrack room intonation,7,NNVDNNN,19832,19838,7
intonation of the worst order and he had,8,NPDANCNV,19838,19845,8
worst order and he had the dirtiest pair,8,ANCNVDAN,19841,19848,8
he had the dirtiest pair of hands i,8,NVDANPNN,19844,19851,8
dirtiest pair of hands i ever saw even,8,ANPNNMVM,19847,19854,8
hands i ever saw even in france,7,NNMVMPN,19850,19856,7
little personal peculiarities exercised however,5,AANVM,19858,19862,5
repelling influence on me in the mad excitement,8,VNPNPDAN,19864,19871,8
reckless triumph of that moment i was,7,ANPDNNV,19873,19879,7
to fraternize with anybody who,5,MVPNN,19881,19885,5
anybody who encouraged me in my game i,8,NNVNPNNN,19884,19891,8
me in my game i accepted,6,NPNNNV,19887,19892,6
my game i accepted the old soldier,7,NNNVDAN,19889,19895,7
old soldier s offered pinch of snuff,7,ANMVNPN,19894,19900,7
pinch of snuff clapped him on the back,8,NPNVNPDN,19898,19905,8
he was the honestest fellow in the world,8,NVDANPDN,19908,19915,8
relic of the grand army that i had,8,NPDANNNV,19919,19926,8
grand army that i had ever met,7,ANNNVMV,19922,19928,7
army that i had ever met with go,8,NNNVMVPN,19923,19930,8
go on cried my military friend,6,NPVNAN,19930,19935,6
my military friend snapping his fingers,6,NANVNN,19933,19938,6
military friend snapping his fingers in ecstasy go,8,ANVNNPAN,19934,19941,8
break the bank mille,4,VDNN,19945,19948,4
bank mille tonnerres my gallant english comrade,7,NNVNANN,19947,19953,7
my gallant english comrade break the bank,7,NANNVDN,19950,19956,7
gallant english comrade break the bank and i,8,ANNVDNCN,19951,19958,8
bank and i did go,5,NCNVV,19956,19960,5
went on at such a rate that,7,VMPDDNN,19962,19968,7
croupier called out gentlemen,4,NVPN,19976,19979,4
bank has discontinued for to night,6,NVVPPN,19981,19986,6
gold in that bank now lay,6,NPDNMV,19993,19998,6
bank now lay in a heap under my,8,NMVPDNPN,19996,20003,8
now lay in a heap under my hands,8,MVPDNPNN,19997,20004,8
whole floating capital of the gambling house was,8,ANNPDNNV,20006,20013,8
floating capital of the gambling house was waiting,8,NNPDNNVV,20007,20014,8
capital of the gambling house was waiting to,8,NPDNNVVM,20008,20015,8
gambling house was waiting to pour into my,8,NNVVMVPN,20011,20018,8
house was waiting to pour into my pockets,8,NVVMVPNN,20012,20019,8
my pockets tie up the money in your,8,NNVPDNPN,20018,20025,8
pockets tie up the money in your pocket,8,NVPDNPNN,20019,20026,8
your pocket handkerchief my worthy sir said,7,NNPNANV,20025,20031,7
my worthy sir said the old soldier,7,NANVDAN,20028,20034,7
worthy sir said the old soldier as i,8,ANVDANCN,20029,20036,8
old soldier as i wildly plunged my hands,8,ANCNMVNN,20033,20040,8
i wildly plunged my hands into my heap,8,NMVNNPNN,20036,20043,8
we used to tie up a bit,7,NVMVPDN,20050,20056,7
used to tie up a bit of dinner,8,VMVPDNPN,20051,20058,8
dinner in the grand army your winnings are,8,NPDANNNV,20058,20065,8
grand army your winnings are too,6,ANNNVM,20061,20066,6
breeches pockets that ever were sewed there that,8,NNNMVVMN,20070,20077,8
that s it,3,NVN,20077,20079,3
it shovel them in notes,5,NVNPN,20079,20083,5
credie what luck,3,VNN,20086,20088,3
what luck stop another napoleon on the floor,8,NNVDNPDN,20087,20094,8
luck stop another napoleon on the floor ah,8,NVDNPDNN,20088,20095,8
napoleon on the floor ah sacre petit,7,NPDNNVV,20091,20097,7
have i,2,VN,20101,20102,2
i found thee,3,NVN,20102,20104,3
feel it,2,VN,20125,20126,2
it feel it fortunate sir,5,NVNAN,20126,20130,5
they had only fired such cannon balls,7,NVMVANN,20141,20147,7
had only fired such cannon balls at us,8,VMVANNPN,20142,20149,8
fired such cannon balls at us at austerlitz,8,VANNPNPN,20144,20151,8
austerlitz nom d'une pipe if they only had,8,NNNNCNMV,20151,20158,8
ex brave of the french army what remains,8,NNPDANNV,20167,20174,8
french army what remains for me,6,ANNVPN,20171,20176,6
me to do i,4,NMVN,20176,20179,4
i ask what,3,NVN,20179,20181,3
this to entreat my,4,NMVN,20183,20186,4
my valued english friend,4,NVAN,20186,20189,4
english friend to drink a bottle of champagne,8,ANMVDNPN,20188,20195,8
to drink a bottle of champagne with me,8,MVDNPNPN,20190,20197,8
toast the goddess fortune,4,VDNN,20199,20202,4
foaming goblets before we,4,VNCN,20204,20207,4
goblets before we part excellent ex,6,NCNVAN,20205,20210,6
we part excellent ex brave convivial ancient grenadier,8,NVANAAAN,20207,20214,8
part excellent ex brave convivial ancient grenadier champagne,8,VANAAANN,20208,20215,8
bravo the englishman,3,VDN,20238,20240,3
amiable gracious englishman in whose veins circulates,7,AANPNNV,20242,20248,7
englishman in whose veins circulates the vivacious blood,8,NPNNVDAN,20244,20251,8
whose veins circulates the vivacious blood of france,8,NNVDANPN,20246,20253,8
bottle is,2,NV,20259,20260,2
never mind vive le vin i,6,MVANPN,20262,20267,6
behold it,2,VN,20296,20297,2
wife and daughters if he has,6,NCNCNV,20315,20320,6
daughters if he has any the ladies,7,NCNVDDN,20317,20323,7
second bottle of champagne was emptied i,7,ANPNVVN,20333,20339,7
i felt,2,NV,20339,20340,2
i had been drinking liquid fire my brain,8,NVVVVVNN,20343,20350,8
my brain seemed all aflame,5,NNVDN,20349,20353,5
excess in wine had ever had this effect,8,NPNVMVDN,20355,20362,8
wine had ever had this effect on me,8,NVMVDNPN,20357,20364,8
my life was it,4,NNVN,20367,20370,4
result of a stimulant acting upon my system,8,NPDNVPNN,20372,20379,8
i was,2,NV,20381,20382,2
excited state was my stomach,5,ANVNN,20386,20390,5
was the champagne,3,VDN,20397,20399,3
french army cried i in a mad state,8,ANVNPDAN,20406,20413,8
cried i in a mad state of exhilaration,8,VNPDANPN,20408,20415,8
mad state of exhilaration i am on fire,8,ANPNNVPN,20412,20419,8
fire how are you you,5,NMVNN,20419,20423,5
you you have set me on fire,7,NNVVNPN,20422,20428,7
me on fire do you,5,NPNVN,20426,20430,5
you hear my hero of austerlitz,6,NVNNPN,20430,20435,6
my hero of austerlitz let us,6,NNPNVN,20432,20437,6
us have a third bottle of champagne,7,NVDANPN,20437,20443,7
third bottle of champagne to put the flame,8,ANPNMVDN,20440,20447,8
to put the flame out the old soldier,8,MVDNPDAN,20444,20451,8
flame out the old soldier wagged his head,8,NPDANVNN,20447,20454,8
his head rolled his goggle eyes until i,8,NNVNNNCN,20453,20460,8
his goggle eyes until i expected to see,8,NNNCNVMV,20456,20463,8
goggle eyes until i expected to see them,8,NNCNVMVN,20457,20464,8
them slip out of their sockets,6,NVPPNN,20464,20469,6
their sockets placed his dirty forefinger,6,NNVNAN,20468,20473,6
sockets placed his dirty forefinger by the side,8,NVNANPDN,20469,20476,8
dirty forefinger by the side of his broken,8,ANPDNPNV,20472,20479,8
forefinger by the side of his broken nose,8,NPDNPNVN,20473,20480,8
nose solemnly ejaculated coffee,4,NMVN,20480,20483,4
immediately ran off into an inner room,7,MVMPDAN,20485,20491,7
word pronounced by the eccentric veteran,6,NVPDAN,20493,20498,6
eccentric veteran seemed to have a magical effect,8,ANVMVDAN,20497,20504,8
to have a magical effect on the rest,8,MVDANPDN,20500,20507,8
effect on the rest of the company present,8,NPDNPDNV,20504,20511,8
rest of the company present with one accord,8,NPDNVPAN,20507,20514,8
company present with one accord they,6,NVPANN,20510,20515,6
rose to depart probably they,5,VMVMN,20517,20521,5
