keyword,ngram,pattern,start,end,phrase_length
old hearts to bear,4,ANMV,29252,29255,4
days passed,2,NV,29258,29259,2
expectation gave place to resignation,5,NVNPN,29261,29265,5
sometimes miscalled apathy sometimes they,5,MVMMN,29273,29277,5
they hardly exchanged a word,5,NMVDN,29277,29281,5
they had nothing,3,NVN,29284,29286,3
nothing to talk,3,NMV,29286,29288,3
their days were,3,NNV,29291,29293,3
to weariness it,3,MVN,29295,29297,3
it was about a week,5,NVPDN,29297,29301,5
old man waking suddenly in the night,7,ANVMPDN,29305,29311,7
night stretched out his hand,5,NVPNN,29311,29315,5
found himself,2,VN,29317,29318,2
himself alone the room,4,NVDN,29318,29321,4
room was in darkness,4,NVPN,29321,29324,4
sound of subdued weeping,4,NPVN,29327,29330,4
weeping came from the window he,6,NVPDNN,29330,29335,6
window he raised himself in bed,6,NNVNPN,29334,29339,6
he said tenderly,3,NVM,29346,29348,3
you will be,3,NVV,29350,29352,3
it is,2,NV,29356,29357,2
said the old woman,4,VDAN,29363,29366,4
wept afresh the sound of her sobs,7,NVDNPNN,29368,29374,7
sound of her sobs died away on his,8,NPNNVMPN,29371,29378,8
her sobs died away on his ears,7,NNVMPNN,29373,29379,7
bed was,2,NV,29381,29382,2
sleep he dozed fitfully,4,NNVM,29389,29392,4
then slept until a sudden wild cry,7,MVPDANN,29394,29400,7
slept until a sudden wild cry from his,8,VPDANNPN,29395,29402,8
sudden wild cry from his wife awoke him,8,ANNPNNVN,29398,29405,8
his wife awoke him with a start,7,NNVNPDN,29402,29408,7
she cried wildly,3,NVM,29413,29415,3
he started up in alarm,5,NVPPN,29422,29426,5
where where is it what,5,MMVNN,29428,29432,5
it what 's the matter,5,NNVDN,29431,29435,5
she came stumbling across the room toward him,8,NVVPDNPN,29437,29444,8
i want it,3,NVN,29446,29448,3
she said quietly,3,NVM,29450,29452,3
you 've not destroyed it,5,NVMVN,29454,29458,5
it 's in the parlour on the bracket,8,NVPDNPDN,29461,29468,8
he replied marvelling,3,NVV,29470,29472,3
she cried,2,NV,29476,29477,2
bending over kissed his cheek,5,VMVNN,29482,29486,5
i only just thought of it,6,NMMVPN,29488,29493,6
she said hysterically,3,NVM,29495,29497,3
why did n't i,4,MVMN,29499,29502,4
i think of it,4,NVPN,29502,29505,4
why did n't you,4,MVMN,29507,29510,4
you think of it,4,NVPN,29510,29513,4
he questioned,2,NV,29520,29521,2
she replied rapidly,3,NVM,29528,29530,3
we 've only had,4,NVMV,29532,29535,4
he demanded fiercely,3,NVM,29544,29546,3
she cried triumphantly,3,NVM,29550,29552,3
we 'll have,3,NVV,29554,29556,3
get it,2,VN,29562,29563,2
wish our boy,3,VNN,29566,29568,3
man sat up in bed,5,NVPPN,29573,29577,5
flung the bedclothes from his quaking limbs,7,VDNPNNN,29579,29585,7
good god you are,4,ANNV,29587,29590,4
he cried aghast,3,NVM,29593,29595,3
get it,2,VN,29597,29598,2
she panted,2,NV,29600,29601,2
get it,2,VN,29603,29604,2
my boy my boy,4,NVNN,29610,29613,4
her husband struck a match,5,NNVDN,29615,29619,5
lit the candle,3,VDN,29621,29623,3
get back to bed,4,VMPN,29625,29628,4
he said unsteadily,3,NVM,29630,29632,3
you do n't know what you,6,NVMVNN,29634,29639,6
what you are saying,4,NNVV,29638,29641,4
we had the first wish,5,NVDAN,29644,29648,5
first wish granted,3,ANV,29647,29649,3
said the old woman,4,VDAN,29651,29654,4
stammered the old man,4,VDAN,29666,29669,4
get it,2,VN,29673,29674,2
cried his wife,3,VNN,29678,29680,3
his wife quivering with excitement,5,NNVPN,29679,29683,5
old man turned,3,ANV,29685,29687,3
regarded her,2,VN,29689,29690,2
he has been dead ten days,6,NVVAAN,29696,29701,6
i would not tell you,5,NVMVN,29706,29710,5
i could only recognize him by his clothing,8,NVMVNPNN,29714,29721,8
he was too,3,NVM,29723,29725,3
you to see then how now,6,NMVMMM,29728,29733,6
bring him,2,VN,29736,29737,2
cried the old woman,4,VDAN,29740,29743,4
dragged him toward the door,5,VNPDN,29745,29749,5
do you,2,VN,29751,29752,2
you think i,3,NVN,29752,29754,3
i fear the child i,5,NVDNN,29754,29758,5
child i have nursed,4,NNVV,29757,29760,4
he went down in the darkness,6,NVMPDN,29762,29767,6
felt his way to the parlour,6,VNNPDN,29769,29774,6
talisman was in its place,5,NVPNN,29781,29785,5
unspoken wish might bring his,5,ANVVN,29792,29796,5
his mutilated son,3,NVN,29796,29798,3
him ere he,3,NVN,29800,29802,3
he could escape from the room,6,NVVPDN,29802,29807,6
room seized upon him,4,NVPN,29807,29810,4
he caught his breath,4,NVNN,29812,29815,4
he found,2,NV,29817,29818,2
he had lost the direction of the door,8,NVVDNPDN,29820,29827,8
had lost the direction of the door his,8,VVDNPDNN,29821,29828,8
lost the direction of the door his brow,8,VDNPDNNN,29822,29829,8
sweat he felt his way round the table,8,NNVNNPDN,29832,29839,8
groped along the wall,4,VPDN,29841,29844,4
he found himself in the small passage,7,NVNPDAN,29846,29852,7
face seemed changed,3,NVV,29864,29866,3
he entered the room it,5,NVDNN,29868,29872,5
room it was,3,NNV,29871,29873,3
his fears seemed to have an unnatural look,8,NNVMVDAN,29879,29886,8
seemed to have an unnatural look upon it,8,VMVDANPN,29881,29888,8
to have an unnatural look upon it he,8,MVDANPNN,29882,29889,8
unnatural look upon it he was,6,ANPNNV,29885,29890,6
she cried in a strong voice,6,NVPDAN,29897,29902,6
it is,2,NV,29904,29905,2
he faltered,2,NV,29910,29911,2
repeated his wife he,4,VNNN,29915,29918,4
his wife he raised his hand,6,NNNVNN,29916,29921,6
i wish my son,4,NVNN,29923,29926,4
he regarded it,3,NVN,29937,29939,3
he sank trembling into a chair,6,NVVPDN,29942,29947,6
trembling into a chair as the old woman,8,VPDNPDAN,29944,29951,8
burning eyes,2,VN,29953,29954,2
eyes walked to the window,5,NVPDN,29954,29958,5
raised the blind he,4,VDAN,29960,29963,4
blind he sat,3,ANV,29962,29964,3
he was chilled with the cold glancing,7,NVVPDAN,29966,29972,7
figure of the old woman peering,6,NPDANV,29976,29981,6
old woman peering through the window,6,ANVPDN,29979,29984,6
candle end which had burned below the rim,8,NNNVVPDN,29986,29993,8
had burned below the rim of the china,8,VVPDNPDN,29989,29996,8
burned below the rim of the china candlestick,8,VPDNPDNN,29990,29997,8
rim of the china candlestick was throwing pulsating,8,NPDNNVVV,29993,30000,8
china candlestick was throwing pulsating shadows,6,NNVVVN,29996,30001,6
candlestick was throwing pulsating shadows on the ceiling,8,NVVVNPDN,29997,30004,8
rest it expired the old man,6,NNVDAN,30014,30019,6
expired the old man with an unspeakable sense,8,VDANPDAN,30016,30023,8
old woman came silently,4,ANVM,30044,30047,4
lay silently listening to the ticking,6,VMVPDN,30055,30060,6
silently listening to the ticking of the clock,8,MVPDNPDN,30056,30063,8
stair creaked,2,NV,30065,30066,2
squeaky mouse scurried noisily through the wall,7,ANVMPDN,30069,30075,7
darkness was,2,NV,30077,30078,2
lying for some time,4,VPDN,30082,30085,4
time screwing up his courage he,6,NVPNNN,30085,30090,6
his courage he took the box of matches,8,NNNVDNPN,30088,30095,8
went downstairs for a candle at the foot,8,VMPDNPDN,30099,30106,8
match went out,3,NVM,30111,30113,3
he paused to strike,4,NVMV,30115,30118,4
sounded on the front door,5,VPDAN,30136,30140,5
matches fell from his hand,5,NVPNN,30142,30146,5
spilled in the passage he,5,VPDNN,30148,30152,5
passage he stood,3,NNV,30151,30153,3
his breath suspended until the knock,6,NNVPDN,30155,30160,6
knock was repeated then he,5,NVVMN,30160,30164,5
he turned,2,NV,30164,30165,2
fled swiftly back to his room,6,VMMPNN,30167,30172,6
closed the door behind him,5,VDNPN,30174,30178,5
third knock sounded through the house illustration,7,ANVPDNN,30180,30186,7
what 's that,3,NVN,30188,30190,3
cried the old woman,4,VDAN,30192,30195,4
old woman starting,3,ANV,30194,30196,3
said the old man,4,VDAN,30202,30205,4
shaking tones,2,VN,30207,30208,2
rat it passed me on the stairs,7,NNVNPDN,30212,30218,7
his wife sat up in bed,6,NNVPPN,30220,30225,6
bed listening a loud knock,5,NVDAN,30225,30229,5
loud knock resounded through the house,6,ANVPDN,30228,30233,6
it 's herbert,3,NVN,30235,30237,3
she screamed,2,NV,30239,30240,2
it 's herbert,3,NVN,30242,30244,3
she ran to the door,5,NVPDN,30246,30250,5
her husband was before her,5,NNVPN,30252,30256,5
catching her by the arm,5,VNPDN,30258,30262,5
her by the arm held her,6,NPDNVN,30259,30264,6
what are you,3,NVN,30267,30269,3
you going to do,4,NVMV,30269,30272,4
he whispered hoarsely,3,NVM,30274,30276,3
it 's my boy it,5,NVNNN,30278,30282,5
my boy it 's herbert,5,NNNVN,30280,30284,5
she cried struggling mechanically,4,NVVM,30286,30289,4
i forgot it,3,NVN,30291,30293,3
it was two miles,4,NVAN,30293,30296,4
what are you,3,NVN,30298,30300,3
you holding me for let go i,7,NVNPNNN,30300,30306,7
me for let go i must open,7,NPNNNVV,30302,30308,7
let go i must open the door,7,NNNVVDN,30304,30310,7
sake do n't let it,5,NVMVN,30316,30320,5
cried the old man,4,VDAN,30323,30326,4
old man trembling,3,ANV,30325,30327,3
you 're,2,NV,30329,30330,2
she cried struggling,3,NVV,30337,30339,3
let me,2,VN,30341,30342,2
me go i,3,NVN,30342,30344,3
i 'm coming herbert i,5,NVVMN,30344,30348,5
i 'm coming,3,NVV,30348,30350,3
there was another knock,4,NVDN,30352,30355,4
old woman with a sudden wrench broke,7,ANPDANV,30359,30365,7
ran from the room her husband,6,VPDNNN,30368,30373,6
room her husband followed to the landing,7,NNNVPDN,30371,30377,7
called after her,3,VPN,30379,30381,3
she hurried downstairs he,4,NVMN,30384,30387,4
he heard the chain rattle,5,NVDNN,30387,30391,5
voice strained,2,NV,30409,30410,2
she cried loudly,3,NVM,30417,30419,3
come down i,3,VMN,30421,30423,3
i ca n't reach it,5,NVMVN,30423,30427,5
her husband was on his hands,6,NNVPNN,30430,30435,6
knees groping wildly on the floor in search,8,NVMPDNPN,30437,30444,8
he could only find it before the thing,8,NVMVNPDN,30449,30456,8
it before the thing outside got,6,NPDNMV,30453,30458,6
thing outside got in a perfect fusillade,7,NMVPDAN,30456,30462,7
outside got in a perfect fusillade of knocks,8,MVPDANPN,30457,30464,8
perfect fusillade of knocks reverberated through the house,8,ANPNVPDN,30461,30468,8
he heard the scraping of a chair,7,NVDNPDN,30470,30476,7
heard the scraping of a chair as his,8,VDNPDNPN,30471,30478,8
scraping of a chair as his wife put,8,NPDNPNNV,30473,30480,8
chair as his wife put it,6,NPNNVN,30476,30481,6
his wife put it down in the passage,8,NNVNPPDN,30478,30485,8
passage against the door he heard the creaking,8,NPDNNVDN,30485,30492,8
door he heard the creaking of the bolt,8,NNVDNPDN,30488,30495,8
it came slowly back,4,NVMM,30497,30500,4
same moment he found the monkey,6,ANNVDN,30504,30509,6
frantically breathed his,3,MVN,30513,30515,3
wish the knocking,3,VDN,30519,30521,3
knocking ceased suddenly,3,NVM,30521,30523,3
echoes of it were still in the house,8,NPNVMPDN,30526,30533,8
it were still in the house he,7,NVMPDNN,30528,30534,7
house he heard the chair drawn,6,NNVDNN,30533,30538,6
door opened a cold wind,5,NVDAN,30542,30546,5
cold wind rushed up the staircase,6,ANVPDN,30545,30550,6
misery from his wife gave him courage,7,NPNNVNN,30559,30565,7
him courage to run down to her side,8,NNMVMPNN,30564,30571,8
gate beyond the street lamp flickering opposite shone,8,NPDNNVAN,30576,30583,8
street lamp flickering opposite shone on a quiet,8,NNVANPDN,30579,30586,8
deserted road one dollar,4,VNAN,30588,30591,4
eighty seven cents that was all,6,AANNVM,30593,30598,6
sixty cents of it was in pennies pennies,8,ANPNVPNN,30600,30607,8
pennies pennies saved,3,NNV,30606,30608,3
bulldozing the grocer,3,VDN,30616,30618,3
cheeks burned with the silent imputation of parsimony,8,NVPDANPN,30629,30636,8
burned with the silent imputation of parsimony that,8,VPDANPNN,30630,30637,8
imputation of parsimony that such close dealing implied,8,NPNNAANV,30634,30641,8
parsimony that such close dealing implied three times,8,NNAANVAN,30636,30643,8
that such close dealing implied three times della,8,NAANVANN,30637,30644,8
three times della counted it one dollar,7,ANNVNAN,30642,30648,7
next day would be christmas there,6,ANVVNN,30655,30660,6
christmas there was clearly nothing,5,NNVMN,30659,30663,5
nothing left to do,4,NVMV,30663,30666,4
flop down on the shabby little couch,7,VMPDAAN,30668,30674,7
howl so della,3,VMN,30676,30678,3
della did it which,4,NVNN,30678,30681,4
it which instigates the moral reflection,6,NNVDAN,30680,30685,6
life is made up of sobs sniffles,7,NVVPPNN,30687,30693,7
smiles with sniffles predominating,4,NPNV,30695,30698,4
mistress of the home is gradually subsiding,7,NPDNVMV,30701,30707,7
home is gradually subsiding from the first stage,8,NVMVPDAN,30704,30711,8
furnished flat at 8 per week it,7,VNPANNN,30722,30728,7
flat at 8 per week it did not,8,NPANNNVM,30723,30730,8
8 per week it did not exactly,7,ANNNVMM,30725,30731,7
per week it did not exactly beggar description,8,NNNVMMAN,30726,30733,8
it certainly had that word on the look,8,NMVDNPDN,30735,30742,8
mendicancy squad in the vestibule below was,7,NNPDNMV,30746,30752,7
squad in the vestibule below was a letter,8,NPDNMVDN,30747,30754,8
vestibule below was a letter box into which,8,NMVDNNPN,30750,30757,8
letter would go,3,NVV,30759,30761,3
mortal finger could coax a ring,6,ANVVDN,30769,30774,6
ring also appertaining thereunto,4,NMVN,30774,30777,4
thereunto was a card,4,NVDN,30777,30780,4
card bearing the name mr james dillingham,7,NVDNNNN,30780,30786,7
name mr james dillingham young the dillingham had,8,NNNNPDNV,30783,30790,8
mr james dillingham young the dillingham had been,8,NNNPDNVV,30784,30791,8
james dillingham young the dillingham had been flung,8,NNPDNVVV,30785,30792,8
dillingham had been flung to the breeze,7,NVVVPDN,30789,30795,7
flung to the breeze during a former period,8,VPDNPDAN,30792,30799,8
its possessor was being paid,5,NNVVV,30803,30807,5
income was shrunk,3,NVN,30814,30816,3
letters of dillingham looked,4,NPNV,30820,30823,4
they were thinking seriously,4,NVVM,30827,30830,4
mr james dillingham young came home,6,ANNMVM,30841,30846,6
reached his,2,VN,30848,30849,2
he was called jim,4,NVVN,30852,30855,4
greatly hugged by mrs james,5,MVPNN,30857,30861,5
mrs james dillingham,3,NNV,30860,30862,3
already introduced to you as della which,7,MVPNPNN,30864,30870,7
you as della which is all very,7,NPNNVMM,30867,30873,7
della which is all very good della,7,NNVMMAN,30869,30875,7
good della finished her cry,5,ANVNN,30874,30878,5
attended to her cheeks with the powder rag,8,VPNNPDNN,30880,30887,8
her cheeks with the powder rag she stood,8,NNPDNNNV,30882,30889,8
powder rag she stood by the window,7,NNNVPDN,30886,30892,7
looked out dully at a grey cat,7,VMMPDNN,30894,30900,7
grey cat walking a grey fence,6,NNVDNN,30899,30904,6
cat walking a grey fence in a grey,8,NVDNNPDN,30900,30907,8
walking a grey fence in a grey backyard,8,VDNNPDNN,30901,30908,8
grey fence in a grey backyard to morrow,8,NNPDNNMV,30903,30910,8
fence in a grey backyard to morrow would,8,NPDNNMVV,30904,30911,8
grey backyard to morrow would be christmas day,8,NNMVVVNN,30907,30914,8
she had only,3,NVM,30916,30918,3
which to buy ji,4,NMVN,30921,30924,4
ji m a present she,5,NVDNN,30924,30928,5
present she had been saving every penny she,8,NNVVVDNN,30927,30934,8
penny she could for months with this result,8,NNVPNPDN,30933,30940,8
could for months with this result twenty dollars,8,VPNPDNAN,30935,30942,8
week does n't go far expenses,6,NVMVAN,30944,30949,6
far expenses had been,4,ANVV,30948,30951,4
she had calculated they,4,NVVN,30954,30957,4
they always are only,4,NMVM,30957,30960,4
to buy a present for jim her ji,8,MVDNPNNN,30962,30969,8
present for jim her ji m,6,NPNNNV,30965,30970,6
happy hour she had spent planning for something,8,ANNVVVPN,30973,30980,8
sterling something,2,VN,30989,30990,2
being owned by jim there,5,VVPNN,31003,31007,5
jim there was a pier glass,6,NNVDNN,31006,31011,6
there was a pier glass between the windows,8,NVDNNPDN,31007,31014,8
you have seen a pier glass,6,NVVDNN,31019,31024,6
seen a pier glass in an 8 bat,8,VDNNPDAN,31021,31028,8
agile person may,3,ANV,31034,31036,3
observing his reflection in a rapid sequence,7,VNNPDAN,31038,31044,7
rapid sequence of longitudinal strips obtain,6,ANPANV,31043,31048,6
accurate conception of his looks della,6,ANPNVN,31051,31056,6
della being slender had mastered the art,7,NVMVVDN,31056,31062,7
she whirled from the window,5,NVPDN,31064,31068,5
stood before the glass her eyes,6,VPDNNN,31070,31075,6
glass her eyes were shining brilliantly,6,NNNVVM,31073,31078,6
her face had lost its colour,6,NNVVNN,31080,31085,6
face had lost its colour within twenty seconds,8,NVVNNPAN,31081,31088,8
she pulled down her hair,5,NVPNN,31090,31094,5
let it,2,VN,31096,31097,2
it fall,2,NV,31097,31098,2
it s full length,4,NVAN,31100,31103,4
there were two possessions of the james,7,NVANPDN,31105,31111,7
were two possessions of the james dillingham youngs,8,VANPDNAN,31106,31113,8
took a mighty pride,4,VDNN,31118,31121,4
was jim,2,VN,31123,31124,2
gold watch that had been his father,7,ANNVVNN,31126,31132,7
was della,2,VN,31140,31141,2
hair had the queen of sheba,6,NVDNPN,31143,31148,6
queen of sheba lived,4,NPNV,31146,31149,4
airshaft della would have let her hair,7,NNVVVNN,31155,31161,7
her hair hang out of the window,7,NNVPPDN,31160,31166,7
day to dry just to depreciate her majesty,8,NMVMMVNN,31168,31175,8
gifts had king solomon,4,NVNN,31179,31182,4
king solomon been the janitor with all his,8,NNVDNPDN,31181,31188,8
solomon been the janitor with all his treasures,8,NVDNPDNN,31182,31189,8
janitor with all his treasures piled,6,NPDNNV,31185,31190,6
his treasures piled up in the basement ji,8,NNVPPDNN,31188,31195,8
treasures piled up in the basement ji m,8,NVPPDNNN,31189,31196,8
basement ji m would have pulled out his,8,NNNVVVPN,31194,31201,8
his watch every time he,5,NVDNN,31201,31205,5
time he passed just to see him,7,NNVMMVN,31204,31210,7
him pluck at his beard from envy,7,NVPNNPN,31210,31216,7
beautiful hair fell about her rippling,6,ANVPNN,31221,31226,6
shining like a cascade of brown waters it,8,VPDNPANN,31228,31235,8
cascade of brown waters it reached below her,8,NPANNVPN,31231,31238,8
brown waters it reached below her knee,7,ANNVPNN,31233,31239,7
made itself,2,VN,31241,31242,2
she did it,3,NVN,31250,31252,3
she faltered for a minute,5,NVPDN,31259,31263,5
splashed on the worn red carpet,6,VPDAAN,31272,31277,6
worn red carpet on went her,6,AANPVN,31275,31280,6
red carpet on went her old brown jacket,8,ANPVNAAN,31276,31283,8
her old brown jacket on went her,7,NAANMVN,31280,31286,7
brown jacket on went her old brown hat,8,ANMVNAAN,31282,31289,8
went her old brown hat with a whirl,8,VNAANPDN,31285,31292,8
her eyes she cluttered out of the door,8,NNNVPPDN,31302,31309,8
she stopped the sign,4,NVDN,31318,31321,4
sign read mme sofronie hair goods,6,NVDANN,31321,31326,6
read mme sofronie hair goods of all kinds,8,VDANNPDN,31322,31329,8
collected herself,2,VN,31336,31337,2
herself panting madame,3,NVM,31337,31339,3
chilly hardly looked the sofronie,5,MMVDN,31343,31347,5
sofronie will you,3,NVN,31347,31349,3
you buy my hair,4,NVNN,31349,31352,4
my hair asked della i,5,NNVNN,31351,31355,5
della i buy hair,4,NNVN,31354,31357,4
hair said,2,NV,31357,31358,2
take yer hat,3,VNN,31360,31362,3
let s,2,VN,31365,31366,2
s have a sight at the looks,7,NVDNPDN,31366,31372,7
have a sight at the looks of it,8,VDNPDNPN,31367,31374,8
sight at the looks of it down rippled,8,NPDNPNMV,31369,31376,8
looks of it down rippled the brown cascade,8,NPNMVDAN,31372,31379,8
it down rippled the brown cascade twenty dollars,8,NMVDANAN,31374,31381,8
brown cascade twenty dollars said madame,6,ANANVN,31378,31383,6
madame lifting the mass,4,NVDN,31383,31386,4
practised hand,2,VN,31389,31390,2
hand give it to me,5,NVNPN,31390,31394,5
it to me quick said della,6,NPNMVN,31392,31397,6
next two hours tripped by on rosy wings,8,AANVPPAN,31401,31408,8
rosy wings forget,3,ANV,31407,31409,3
hashed metaphor she,3,VNN,31411,31413,3
metaphor she was ransacking the stores for jim,8,NNVVDNPN,31412,31419,8
present she found it at last it,7,NNVNPAN,31421,31427,7
it at last it surely had been made,8,NPANMVVV,31424,31431,8
last it surely had been made for jim,8,ANMVVVPN,31426,31433,8
one else there was,4,NANV,31436,31439,4
she had turned,3,NVV,31450,31452,3
it was a platinum fob chain,6,NVDNNN,31458,31463,6
chaste in design,3,VPN,31466,31468,3
design properly proclaiming it,4,NMVN,31468,31471,4
it s value by substance,5,NVNPN,31471,31475,5
good things should do it,5,ANVVN,31484,31488,5
it was even,3,NVM,31488,31490,3
she saw it she,4,NVNN,31498,31501,4
it she knew,3,NNV,31500,31502,3
it must be jim,4,NVVN,31504,31507,4
it was like him quietness,5,NVPNN,31509,31513,5
value the description,3,VDN,31515,31517,3
description applied,2,NV,31517,31518,2
twenty one dollars they took from her,7,AANNVPN,31521,31527,7
one dollars they took from her for it,8,ANNVPNPN,31522,31529,8
she hurried home with the 78 cents,7,NVMPDAN,31531,31537,7
ji m might be properly,5,NNVVM,31544,31548,5
watch was he,3,NVN,31559,31561,3
he sometimes looked at it on the sly,8,NMVPNPDN,31561,31568,8
looked at it on the sly on account,8,VPNPDNPN,31563,31570,8
he used in place of a chain,7,NVPNPDN,31577,31583,7
della reached home her intoxication,5,NVMNN,31585,31589,5
her intoxication gave way a little to prudence,8,NNVMDNPN,31588,31595,8
reason she got out her curling irons,7,NNVPNNN,31597,31603,7
lighted the gas,3,VDN,31605,31607,3
went to work repairing the ravages,6,VMVVDN,31609,31614,6
ravages made by generosity,4,NVPN,31614,31617,4
generosity added to love which,5,NVMVN,31617,31621,5
which is always a tremendous task dear friends,8,NVMDANAN,31621,31628,8
mammoth task within forty minutes her head was,8,ANPANNNV,31630,31637,8
task within forty minutes her head was covered,8,NPANNNVV,31631,31638,8
lying curls that,3,VNN,31642,31644,3
curls that made her,4,NNVN,31643,31646,4
her look wonderfully like a truant schoolboy she,8,NVMPDANN,31646,31653,8
truant schoolboy she looked at her reflection,7,ANNVPNN,31651,31657,7
she looked at her reflection in the mirror,8,NVPNNPDN,31653,31660,8
jim does n't kill me she,6,NVMVNN,31666,31671,6
me she said to herself,5,NNVPN,31670,31674,5
he takes a second look at me he,8,NVDANPNN,31676,31683,8
second look at me he ll say i,8,ANPNNVVN,31679,31686,8
i look like a coney island chorus girl,8,NVPDNNNN,31686,31693,8
what could i,3,NVN,31695,31697,3
i do,2,NV,31697,31698,2
what could i,3,NVN,31700,31702,3
i do with a dollar,5,NVPDN,31702,31706,5
eighty seven cents at 7 o'clock,6,NVNPAN,31708,31713,6
coffee was made,3,NVV,31715,31717,3
frying pan was on the back,6,ANVPDN,31720,31725,6
pan was on the back of the stove,8,NVPDNPDN,31721,31728,8
to cook the chops jim,5,MVDNN,31732,31736,5
chops jim was never late della,6,NNVMAN,31735,31740,6
late della doubled the fob chain in her,8,ANVDNNPN,31739,31746,8
della doubled the fob chain in her hand,8,NVDNNPNN,31740,31747,8
sat on the corner of the table,7,VPDNPDN,31749,31755,7
he always entered then she,5,NMVMN,31760,31764,5
she heard his step on the stair,7,NVNNPDN,31764,31770,7
she turned,2,NV,31778,31779,2
moment she had a habit,5,NNVDN,31784,31788,5
saying little silent prayers,4,VAAN,31790,31793,4
she whispered,2,NV,31802,31803,2
god make him,3,NVN,31805,31807,3
him think i,3,NVN,31807,31809,3
i am still pretty the door,6,NVMMDN,31809,31814,6
door opened,2,NV,31814,31815,2
jim stepped in,3,NVM,31817,31819,3
closed it he,3,VNN,31821,31823,3
it he looked,3,NNV,31822,31824,3
serious poor fellow he was only,6,AANNVM,31828,31833,6
to be burdened with a family he,7,MVVPDNN,31837,31843,7
family he needed a new overcoat,6,NNVDAN,31842,31847,6
he was with out gloves jim,6,NVPPNN,31849,31854,6
gloves jim stepped inside the door,6,NNVPDN,31853,31858,6
scent of quail his eyes were fixed,7,NPNNNVV,31866,31872,7
quail his eyes were fixed upon della,7,NNNVVPN,31868,31874,7
there was an expression in them,6,NVDNPN,31876,31881,6
she could not read,4,NVMV,31883,31886,4
it terrified her it,4,NVNN,31888,31891,4
her it was not anger,5,NNVMN,31890,31894,5
she had been prepared for he,6,NVVVPN,31907,31912,6
he simply stared at her,5,NMVPN,31912,31916,5
peculiar expression on his face della wriggled,7,ANPNNNV,31920,31926,7
his face della wriggled off the table,7,NNNVPDN,31923,31929,7
went for him ji,4,VPNN,31931,31934,4
him ji m darling she,5,NNVVN,31933,31937,5
she cried do n't look at me,7,NVVMVPN,31937,31943,7
way i had my hair,5,NNVNN,31945,31949,5
my hair cut,3,NNV,31948,31950,3
sold it,2,VN,31953,31954,2
i could n't have lived through christmas,7,NVMVVPN,31956,31962,7
giving you,2,VN,31964,31965,2
present it ll grow,4,ANVV,31967,31970,4
you wo n't mind will you i,7,NVMVVNN,31973,31979,7
you i just had to do it my,8,NNMVMVNN,31978,31985,8
i just had to do it my hair,8,NMVMVNNN,31979,31986,8
it my hair grows awfully fast say,7,NNNVMMV,31984,31990,7
my hair grows awfully fast say merry christmas,8,NNVMMVAN,31985,31992,8
hair grows awfully fast say merry christmas jim,8,NVMMVANN,31986,31993,8
let s be happy you,5,VMVAN,31995,31999,5
happy you do n't know what,6,ANVMVN,31998,32003,6
beautiful nice gift i ve got for you,8,AANNVVPN,32008,32015,8
nice gift i ve got for you you,8,ANNVVPNN,32009,32016,8
you you ve cut off your hair,7,NNVVPNN,32015,32021,7
your hair asked ji,4,NNVN,32020,32023,4
ji m laboriously,3,NVM,32023,32025,3
he had not arrived at that patent fact,8,NVMVPDNN,32028,32035,8
hardest mental labour cut it,5,AANVN,32040,32044,5
sold it,2,VN,32047,32048,2
it said della,3,NVN,32048,32050,3
della do n't you,4,NVMN,32050,32053,4
you like me,3,NVN,32053,32055,3
i m me without my hair,6,NVNPNN,32060,32065,6
me without my hair ai n't i ji,8,NPNNVMNN,32062,32069,8
i ji m looked about the room,7,NNVVPDN,32068,32074,7
you say your hair,4,NVNN,32076,32079,4
your hair is gone he,5,NNVVN,32078,32082,5
he said with an air,5,NVPDN,32082,32086,5
idiocy you need n't look for it,7,NNVMVPN,32089,32095,7
it said della it,4,NVNN,32095,32098,4
della it s sold i,5,NNVVN,32097,32101,5
i tell you,3,NVN,32101,32103,3
you sold,2,NV,32103,32104,2
gone too it,3,VMN,32106,32108,3
it s christmas eve boy,5,NVNAN,32108,32112,5
