keyword,ngram,pattern,start,end,phrase_length
bird struck their minds at this time,7,NVNNPDN,18160,18166,7
correspondent rowed,2,NV,18180,18181,2
they rowed they,3,NVN,18184,18186,3
they sat together in the same seat,7,NVMPDAN,18186,18192,7
oiler took both oars,4,NVDN,18200,18203,4
correspondent took both oars,4,NVDN,18206,18209,4
correspondent they rowed,3,NNV,18215,18217,3
they rowed,2,NV,18219,18220,2
ticklish part of the business was when,7,ANPDNVM,18223,18229,7
part of the business was when the time,8,NPDNVMDN,18224,18231,8
time came,2,NV,18231,18232,2
reclining one in the stern,5,VNPDN,18235,18239,5
one in the stern to take his turn,8,NPDNMVNN,18236,18243,8
stern to take his turn at the oars,8,NMVNNPDN,18239,18246,8
last star of truth it is,6,ANPNNV,18250,18255,6
to steal eggs from under a hen,7,MVNPPDN,18257,18263,7
it was to change seats in the dingey,8,NVMVNPDN,18265,18272,8
man in the stern slid his hand,7,NPDNVNN,18275,18281,7
stern slid his hand along the thwart,7,NVNNPDN,18278,18284,7
moved with care,3,VPN,18286,18288,3
he were of sevres,4,NVPN,18291,18294,4
man in the rowing seat slid his hand,8,NPDNNVNN,18297,18304,8
seat slid his hand along the other thwart,8,NVNNPDAN,18301,18308,8
slid his hand along the other thwart it,8,VNNPDANN,18302,18309,8
his hand along the other thwart it was,8,NNPDANNV,18303,18310,8
hand along the other thwart it was all,8,NPDANNVM,18304,18311,8
other thwart it was all done,6,ANNVMV,18307,18312,6
whole party kept watchful eyes,5,ANVAN,18326,18330,5
coming wave,2,VN,18333,18334,2
captain cried look,3,NVV,18337,18339,3
brown mats of sea weed that appeared,7,ANPNNNV,18345,18351,7
mats of sea weed that appeared from time,8,NPNNNVPN,18346,18353,8
sea weed that appeared from time to time,8,NNNVPNPN,18348,18355,8
time to time were like islands bits,7,NPNVPNN,18353,18359,7
time were like islands bits of earth they,8,NVPNNPNN,18355,18362,8
islands bits of earth they were travelling apparently,8,NNPNNVVM,18358,18365,8
earth they were travelling apparently neither one way,8,NNVVMDAN,18361,18368,8
other they were to all intents stationary they,8,ANVPDNNN,18371,18378,8
intents stationary they informed the men,6,NNNVDN,18376,18381,6
stationary they informed the men in the boat,8,NNVDNPDN,18377,18384,8
it was making progress,4,NVVN,18386,18389,4
captain rearing cautiously in the bow,6,NVMPDN,18395,18400,6
rearing cautiously in the bow after the dingey,8,VMPDNPDN,18396,18403,8
bow after the dingey soared,5,NPDNV,18400,18404,5
dingey soared on a great swell,6,NVPDAN,18403,18408,6
great swell said,3,ANV,18407,18409,3
he had seen the lighthouse at mosquito,7,NVVDNPN,18411,18417,7
cook remarked,2,NV,18421,18422,2
he had seen it,4,NVVN,18424,18427,4
correspondent was at the oars,5,NVPDN,18429,18433,5
reason he too wished to look,6,NNMVMV,18438,18443,6
he too wished to look at the lighthouse,8,NMVMVPDN,18439,18446,8
his back was toward the far shore,7,NNVPDAN,18448,18454,7
waves were,2,NV,18457,18458,2
time he could not seize an opportunity,7,NNVMVDN,18463,18469,7
opportunity to turn his head,5,NMVNN,18469,18473,5
there came a wave,4,MVDN,18477,18480,4
crest of it he swiftly scoured,6,NPNNMV,18490,18495,6
it he swiftly scoured the western horizon,7,NNMVDAN,18492,18498,7
western horizon see it,4,ANVN,18497,18500,4
it said the captain,4,NVDN,18500,18503,4
captain no said the correspondent,5,NMVDN,18503,18507,5
i did n't see anything,5,NVMVN,18509,18513,5
anything look again said the captain he,7,NVMVDNN,18513,18519,7
captain he pointed it,4,NNVN,18518,18521,4
it s exactly in that direction,6,NVMPDN,18521,18526,6
s exactly in that direction at the top,8,VMPDNPDN,18522,18529,8
correspondent did,2,NV,18534,18535,2
he was,2,NV,18537,18538,2
time his eyes chanced on a small still,8,NNNVPDAN,18542,18549,8
his eyes chanced on a small still thing,8,NNVPDANN,18543,18550,8
swaying horizon it,3,VNN,18556,18558,3
horizon it was precisely like the point,7,NNVMPDN,18557,18563,7
was precisely like the point of a pin,8,VMPDNPDN,18559,18566,8
point of a pin it took,6,NPDNNV,18563,18568,6
pin it took an anxious eye,6,NNVDAN,18566,18571,6
anxious eye to find a lighthouse,6,ANMVDN,18570,18575,6
tiny think we ll make it,6,ANNVVN,18577,18582,6
it captain,2,NV,18582,18583,2
boat do n't swamp we,5,NVMVN,18590,18594,5
we ca n't do much else said,7,NVMVMMV,18594,18600,7
captain the little boat,4,VDAN,18602,18605,4
little boat lifted by each towering sea,7,ANVPDNN,18604,18610,7
splashed viciously by the crests,5,VMPDN,18612,18616,5
crests made progress that in the absence,7,NVNNPDN,18616,18622,7
made progress that in the absence of sea,8,VNNPDNPN,18617,18624,8
that in the absence of sea weed was,8,NPDNPNNV,18619,18626,8
absence of sea weed was not,6,NPNNVM,18622,18627,6
those in her she seemed just,6,NPNNVM,18630,18635,6
her she seemed just a wee thing,7,NNVMDAN,18632,18638,7
wee thing wallowing miraculously top,5,ANVMV,18637,18641,5
thing wallowing miraculously top up at the mercy,8,NVMVPPDN,18638,18645,8
top up at the mercy of five oceans,8,VPPDNPAN,18641,18648,8
great spread of water like white flames swarmed,8,ANPNPANV,18651,18658,8
water like white flames swarmed into her bail,8,NPANVPNN,18654,18661,8
white flames swarmed into her bail her cook,8,ANVPNNNN,18656,18663,8
her bail her cook said the captain,7,NNNNVDN,18660,18666,7
right captain said the cheerful cook it,7,ANVDANN,18669,18675,7
cheerful cook it would be,5,ANNVV,18673,18677,5
to describe the subtle brotherhood of men that,8,MVDANPNN,18679,18686,8
subtle brotherhood of men that was here established,8,ANPNNVMV,18682,18689,8
men that was here established on the seas,8,NNVMVPDN,18685,18692,8
one said,2,NV,18694,18695,2
it was so no one,5,NVMDN,18697,18701,5
one mentioned it,3,NVN,18701,18703,3
it dwelt in the boat,5,NVPDN,18705,18709,5
man felt it warm him they,6,NVNANN,18712,18717,6
it warm him they were a captain,7,NANNVDN,18714,18720,7
they were friends friends,4,NVNN,18729,18732,4
iron bound degree than may be,6,AANPVV,18737,18742,6
hurt captain,2,VN,18745,18746,2
captain lying against the water jar,6,NVPDNN,18746,18751,6
lying against the water jar in the bow,8,VPDNNPDN,18747,18754,8
water jar in the bow spoke always,7,NNPDNVM,18750,18756,7
bow spoke always in a low voice,7,NVMPDAN,18754,18760,7
he could never command,4,NVMV,18764,18767,4
dingey it was,3,NNV,18781,18783,3
what was,2,NV,18790,18791,2
common safety there was surely in it,7,ANNVMPN,18795,18801,7
quality that was,3,NNV,18803,18805,3
commander of the boat there was this comradeship,8,NPDNNVDN,18815,18822,8
correspondent for instance who had been taught to,8,NPNNVVVM,18825,18832,8
instance who had been taught to be,7,NNVVVMV,18827,18833,7
men knew even at the time,6,NVMPDN,18836,18841,6
time was the best experience of his life,8,NVDANPNN,18841,18848,8
one said,2,NV,18851,18852,2
it was so no one,5,NVMDN,18854,18858,5
one mentioned it i,4,NVNN,18858,18861,4
it i wish we,4,NNVN,18860,18863,4
we had a sail,4,NVDN,18863,18866,4
sail remarked the captain we,5,NVDNN,18866,18870,5
captain we might try my overcoat,6,NNVVNN,18869,18874,6
we might try my overcoat on the end,8,NVVNNPDN,18870,18877,8
give you two boys,4,VNAN,18882,18885,4
chance to rest so the cook,6,NMVMDN,18887,18892,6
correspondent held the mast,4,NVDN,18895,18898,4
spread wide the overcoat,4,VPDN,18900,18903,4
oiler steered,2,NV,18905,18906,2
little boat made good way with her,7,ANVANPN,18909,18915,7
boat made good way with her new rig,8,NVANPNAN,18910,18917,8
oiler had to scull sharply to keep,7,NVMVMMV,18920,18926,7
had to scull sharply to keep a sea,8,VMVMMVDN,18921,18928,8
breaking into the boat,4,VPDN,18930,18933,4
sailing was a success,4,NVDN,18936,18939,4
lighthouse had been growing slowly larger it,7,NVVVMAN,18942,18948,7
larger it had now almost assumed colour,7,ANVMMVN,18947,18953,7
appeared like a little grey shadow,6,VPDANN,18955,18960,6
man at the oars could not be prevented,8,NPDNVMVV,18965,18972,8
turning his head,3,VNN,18974,18976,3
his head rather often to try,6,NNMMMV,18975,18980,6
head rather often to try for a glimpse,8,NMMMVPDN,18976,18983,8
try for a glimpse of this little grey,8,VPDNPDAN,18980,18987,8
wave the men in the tossing boat,7,VDNPDNN,18996,19002,7
men in the tossing boat could see land,8,NPDNNVVN,18998,19005,8
lighthouse was an upright shadow on the sky,8,NVDANPDN,19009,19016,8
land seemed,2,NV,19018,19019,2
black shadow on the sea it certainly was,8,ANPDNNMV,19023,19030,8
paper we must be about opposite new smyrna,8,NNVVMAAN,19033,19040,8
opposite new smyrna said the cook who,7,AANVDNN,19038,19044,7
cook who had coasted this shore,6,NNVVDN,19043,19048,6
schooners captain by the way i,6,NVPDNN,19051,19056,6
way i believe they,4,NNVN,19055,19058,4
they abandoned that life,4,NVDN,19058,19061,4
life saving station,3,NVN,19061,19063,3
year ago did they,4,NMVN,19067,19070,4
they said,2,NV,19070,19071,2
captain the wind,3,VDN,19073,19075,3
wind slowly died away the cook,6,NMVPDN,19075,19080,6
correspondent were not now obliged to slave,7,NVMMVMV,19083,19089,7
were not now obliged to slave in order,8,VMMVMVPN,19084,19091,8
order to hold high the oar,6,NMVMDN,19091,19096,6
waves continued their,3,NVN,19099,19101,3
swooping at the dingey,4,VPDN,19104,19107,4
way struggled woundily over them,5,NVMPN,19115,19119,5
correspondent took the oars,4,NVDN,19124,19127,4
shipwrecks are a propos of nothing,6,NVDNPN,19129,19134,6
men could only train for them,6,NVMVPN,19136,19141,6
have them,2,VN,19143,19144,2
them occur when the men,5,NVMDN,19144,19148,5
men had reached pink condition there,6,NVVANN,19148,19153,6
pink condition there would be,5,ANNVV,19151,19155,5
drowning at sea,3,VPN,19157,19159,3
dingey none had slept any time,6,NNVVDN,19165,19170,6
mentioning for two days,4,VPAN,19172,19175,4
embarking in the dingey,4,VPDN,19181,19184,4
clambering about the deck,4,VPDN,19190,19193,4
foundering ship they,3,VNN,19196,19198,3
ship they had also,4,NNVM,19197,19200,4
to eat heartily for these reasons,6,MVMPDN,19202,19207,6
correspondent was,2,NV,19216,19217,2
rowing at this time,4,VPDN,19220,19223,4
correspondent wondered ingenuously how in the name,7,NVMMPDN,19225,19231,7
name of all that was,5,NPDNV,19231,19235,5
could there,2,VN,19237,19238,2
there be people who,4,NVNN,19238,19241,4
people who thought it,4,NNVN,19240,19243,4
it amusing to row a boat it,7,NVMVDNN,19243,19249,7
boat it was not an amusement it,7,NNVMDNN,19248,19254,7
amusement it was a diabolical punishment,6,NNVDAN,19253,19258,6
genius of mental aberrations could never conclude,7,NPANVMV,19262,19268,7
it was anything,3,NVN,19270,19272,3
crime against the back he mentioned,6,NPDNNV,19281,19286,6
back he mentioned to the boat,6,NNVPDN,19284,19289,6
rowing struck him,3,VVN,19296,19298,3
weary faced oiler smiled in full sympathy,7,AANVPAN,19301,19307,7
oiler had worked double watch in the engine,8,NVVANPDN,19316,19323,8
had worked double watch in the engine room,8,VVANPDNN,19317,19324,8
engine room of the ship take her,7,NNPDNVN,19323,19329,7
boys said the captain,4,NVDN,19332,19335,4
captain do n't spend yourselves,5,NVMVN,19335,19339,5
we have to run a surf you,7,NVMVDNN,19341,19347,7
surf you ll need all your strength,7,NNVVDNN,19346,19352,7
we ll sure have to swim for it,8,NVMVMVPN,19354,19361,8
it take your time,4,NVNN,19361,19364,4
land arose from the sea,5,NVPDN,19367,19371,5
arose from the sea from a black line,8,VPDNPDAN,19368,19375,8
sea from a black line it became,7,NPDANNV,19371,19377,7
black line it became a line,6,ANNVDN,19374,19379,6
sand finally the captain,4,VMDN,19389,19392,4
captain said,2,NV,19392,19393,2
he could make out a house,6,NVVPDN,19395,19400,6
could make out a house on the shore,8,VVPDNPDN,19396,19403,8
make out a house on the shore that,8,VPDNPDNN,19397,19404,8
house on the shore that s the house,8,NPDNNVDN,19400,19407,8
shore that s the house of refuge,7,NNVDNPN,19403,19409,7
said the cook they,4,VDNN,19411,19414,4
cook they ll see us,5,NNVVN,19413,19417,5
come out after us,4,VMPN,19421,19424,4
distant lighthouse reared high the keeper,6,ANVMDN,19426,19431,6
keeper ought to be,4,NVMV,19431,19434,4
to make us,3,MVN,19436,19438,3
he s looking through a glass,6,NVVPDN,19442,19447,6
glass said the captain he,5,NVDNN,19447,19451,5
captain he ll notify the life,6,NNVVDN,19450,19455,6
life saving people none of those other boats,8,NVNNPDAN,19455,19462,8
people none of those other boats could have,8,NNPDANVV,19457,19464,8
none of those other boats could have got,8,NPDANVVV,19458,19465,8
other boats could have got ashore to give,8,ANVVVMMV,19461,19468,8
boats could have got ashore to give word,8,NVVVMMVN,19462,19469,8
got ashore to give word of the wreck,8,VMMVNPDN,19465,19472,8
word of the wreck said the oiler,7,NPDNVDN,19469,19475,7
wreck said the oiler in a low voice,8,NVDNPDAN,19472,19479,8
oiler in a low voice else the life,8,NPDANVDN,19475,19482,8
low voice else the life boat,6,ANVDNN,19478,19483,6
life boat would be out hunting us,7,NNVVMVN,19482,19488,7
land loomed out of the sea,6,NVPPDN,19493,19498,6
wind came again it,4,NVMN,19500,19503,4
it had veered from the north,6,NVVPDN,19503,19508,6
new sound struck the ears of the men,8,ANVDNPDN,19516,19523,8
men in the boat it was,6,NPDNNV,19523,19528,6
boat it was the low thunder,6,NNVDAN,19526,19531,6
it was the low thunder of the surf,8,NVDANPDN,19527,19534,8
surf on the shore we ll never be,8,NPDNNVMV,19534,19541,8
to make the lighthouse,4,MVDN,19543,19546,4
lighthouse now said the captain,5,NMVDN,19546,19550,5
captain swing her head,4,NVNN,19550,19553,4
said he,2,VN,19559,19560,2
sir said the oiler whereupon the little boat,8,NVDNPDAN,19565,19572,8
oiler whereupon the little boat turned her nose,8,NPDANVNN,19568,19575,8
oarsman watched the shore,4,NVDN,19585,19588,4
shore grow under the influence of this expansion,8,NVPDNPDN,19588,19595,8
grow under the influence of this expansion doubt,8,VPDNPDNN,19589,19596,8
direful apprehension was leaving the minds,6,ANVVDN,19598,19603,6
apprehension was leaving the minds of the men,8,NVVDNPDN,19599,19606,8
management of the boat was still most absorbing,8,NPDNVMMV,19608,19615,8
it could not prevent a quiet cheerfulness,7,NVMVDAN,19617,19623,7
not prevent a quiet cheerfulness in an hour,8,MVDANPDN,19619,19626,8
they would be ashore their backbones,6,NVVVNN,19628,19633,6
their backbones had become thoroughly,5,NNVVM,19632,19636,5
to balancing in the boat,5,MVPDN,19638,19642,5
they now rode this wild colt,6,NMVDAN,19644,19649,6
now rode this wild colt of a dingey,8,MVDANPDN,19645,19652,8
correspondent thought,2,NV,19657,19658,2
he had been drenched to the skin,7,NVVVPDN,19660,19666,7
happening to feel in the top pocket,7,VMVPDAN,19668,19674,7
to feel in the top pocket of his,8,MVPDANPN,19669,19676,8
feel in the top pocket of his coat,8,VPDANPNN,19670,19677,8
top pocket of his coat he found therein,8,ANPNNNVM,19673,19680,8
his coat he found therein eight cigars,7,NNNVMAN,19676,19682,7
them were soaked with sea water,6,NVVPNN,19685,19690,6
search somebody produced three dry matches,6,NNVAAN,19697,19702,6
four waifs rode impudently in their little boat,8,ANVMPNAN,19706,19713,8
impending rescue,2,VN,19720,19721,2
rescue shining in their eyes,5,NVPNN,19721,19725,5
their eyes puffed at the big cigars,7,NNVPDAN,19724,19730,7
men everybody took a drink of water cook,8,NNVDNPNN,19738,19745,8
drink of water cook remarked the captain,7,NPNNVDN,19742,19748,7
captain there do n't seem to be,7,NMVMVMV,19748,19754,7
there do n't seem to be any signs,8,MVMVMVDN,19749,19756,8
n't seem to be any signs of life,8,MVMVDNPN,19751,19758,8
to be any signs of life about your,8,MVDNPNPN,19753,19760,8
be any signs of life about your house,8,VDNPNPNN,19754,19761,8
replied the cook funny they,5,VDNNN,19765,19769,5
cook funny they do n't see us,7,NNNVMVN,19767,19773,7
broad stretch of lowly coast lay,6,ANPANV,19775,19780,6
stretch of lowly coast lay before the eyes,8,NPANVPDN,19776,19783,8
coast lay before the eyes of the men,8,NVPDNPDN,19779,19786,8
lay before the eyes of the men it,8,VPDNPDNN,19780,19787,8
eyes of the men it was of dunes,8,NPDNNVPN,19783,19790,8
dunes topped with dark vegetation,5,NVPAN,19790,19794,5
roar of the surf was,5,NPDNV,19796,19800,5
they could see the white lip,6,NVVDAN,19804,19809,6
could see the white lip of a wave,8,VVDANPDN,19805,19812,8
it spun up the beach,5,NVPDN,19814,19818,5
tiny house was blocked,4,ANVV,19820,19823,4
slim lighthouse lifted its little grey length tide,8,ANVNANNN,19831,19838,8
lighthouse lifted its little grey length tide wind,8,NVNANNNN,19832,19839,8
waves were swinging the dingey,5,NVVDN,19841,19845,5
funny they do n't see us,6,ANVMVN,19847,19852,6
us said the men,4,NVDN,19852,19855,4
roar was here dulled,4,NVMV,19859,19862,4
it s tone,3,NVN,19864,19866,3
tone was nevertheless,3,NVM,19866,19868,3
men sat listening to this roar we,7,NVVPDNN,19881,19887,7
roar we ll swamp,4,NNVV,19886,19889,4
said everybody it,3,VNN,19891,19893,3
everybody it is,3,NNV,19892,19894,3
there was not a life,5,NVMDN,19900,19904,5
life saving station within twenty miles,6,NVNPAN,19904,19909,6
men did not know this fact,6,NVMVDN,19915,19920,6
consequence they made,3,NNV,19923,19925,3
opprobrious remarks concerning the eyesight of the nation,8,ANVDNPDN,19928,19935,8
life savers four scowling men sat,6,NNANNV,19937,19942,6
savers four scowling men sat in the dingey,8,NANNVPDN,19938,19945,8
surpassed records in the invention of epithets,7,VNPDNPN,19947,19953,7
invention of epithets funny they do n't see,8,NPNANVMV,19951,19958,8
epithets funny they do n't see us,7,NANVMVN,19953,19959,7
light heartedness of a former time had completely,8,NNPDANVM,19961,19968,8
heartedness of a former time had completely faded,8,NPDANVMV,19962,19969,8
former time had completely faded to their,7,ANVMVPN,19965,19971,7
their sharpened minds it,4,NVNN,19971,19974,4
minds it was,3,NNV,19973,19975,3
to conjure pictures of all kinds of incompetency,8,MVNPDNPN,19977,19984,8
cowardice there was the shore,5,NNVDN,19989,19993,5
there was the shore of the populous land,8,NVDNPDAN,19990,19997,8
it was,2,NV,19999,20000,2
it came no sign,4,NVDN,20008,20011,4
sign well said the captain,5,NMVDN,20011,20015,5
i suppose we,3,NVN,20017,20019,3
we ll have to make a try,7,NVVMVDN,20019,20025,7
ll have to make a try for ourselves,8,VVMVDNPN,20020,20027,8
we stay,2,NV,20029,20030,2
we ll none of us,5,NVNPN,20035,20039,5
none of us have strength,5,NPNVN,20037,20041,5
strength left to swim after the boat swamps,8,NVMVPDNN,20041,20048,8
oiler who was at the oars,6,NNVPDN,20052,20057,6
oars turned the boat,4,NVDN,20057,20060,4
shore there was a sudden tightening of muscles,8,NMVDANPN,20064,20071,8
there was a sudden tightening of muscles there,8,MVDANPNN,20065,20072,8
sudden tightening of muscles there was some thinking,8,ANPNNVDN,20068,20075,8
we do n't all get ashore,6,NVMMVM,20077,20082,6
said the captain,3,VDN,20084,20086,3
we do n't all get,5,NVMMV,20088,20092,5
i suppose you fellows,4,NVNN,20094,20097,4
you fellows know where to send news,7,NNVMMVN,20096,20102,7
fellows know where to send news of my,8,NVMMVNPN,20097,20104,8
know where to send news of my finish,8,VMMVNPNN,20098,20105,8
where to send news of my finish they,8,MMVNPNNN,20099,20106,8
news of my finish they then briefly exchanged,8,NPNNNMMV,20102,20109,8
my finish they then briefly exchanged some addresses,8,NNNMMVDN,20104,20111,8
reflections of the men there was,6,NPDNMV,20117,20122,6
men there was a great deal of rage,8,NMVDANPN,20120,20127,8
was a great deal of rage in them,8,VDANPNPN,20122,20129,8
they might be formulated thus,5,NVVVM,20131,20135,5
i am going to be drowned,6,NVVMVV,20137,20142,6
i am going to be drowned,6,NVVMVV,20145,20150,6
i am going to be drowned why,7,NVVMVVM,20153,20159,7
going to be drowned why in the name,8,VMVVMPDN,20155,20162,8
name of the seven mad gods who rule,8,NPDAANNV,20162,20169,8
seven mad gods who rule the sea,7,AANNVDN,20165,20171,7
sea was i,3,NVN,20171,20173,3
i allowed to come thus far,6,NVMVMM,20173,20178,6
contemplate sand,2,VN,20180,20181,2
trees was i,3,NVN,20183,20185,3
i brought here merely to have my nose,8,NVMMMVNN,20185,20192,8
my nose dragged away,4,NNVM,20191,20194,4
i was about to nibble the sacred cheese,8,NVMMVDAN,20196,20203,8
about to nibble the sacred cheese of life,8,MMVDANPN,20198,20205,8
to nibble the sacred cheese of life it,8,MVDANPNN,20199,20206,8
sacred cheese of life it is,6,ANPNNV,20202,20207,6
old ninny woman fate can not do,7,ANNNVMV,20211,20217,7
this she should be deprived of the management,8,NNVVVPDN,20220,20227,8
should be deprived of the management of men,8,VVVPDNPN,20222,20229,8
fortunes she is an old hen who,7,NNVDANN,20231,20237,7
old hen who knows not her intention,7,ANNVMNN,20235,20241,7
she has decided to drown me,6,NVVMVN,20243,20248,6
me why did she,4,NMVN,20248,20251,4
she not do it in the beginning,7,NMVNPDN,20251,20257,7
save me,2,VN,20259,20260,2
whole affair is,3,ANV,20265,20267,3
she can not mean to drown me she,8,NVMVMVNN,20271,20278,8
me she dare not drown me she,7,NNVMVNN,20277,20283,7
me she can not drown me,6,NNVMVN,20282,20287,6
man might have had an impulse,6,NVVVDN,20295,20300,6
impulse to shake his fist at the clouds,8,NMVNNPDN,20300,20307,8
you drown me,3,NVN,20309,20311,3
then hear what i,4,MVNN,20314,20317,4
what i call you,4,NNVN,20316,20319,4
billows that came at this time,6,NNVPDN,20321,20326,6
time were more formidable they,5,NVMAN,20326,20330,5
formidable they seemed always just about to break,8,ANVMMMMV,20329,20336,8
roll over the little boat in a turmoil,8,VPDANPDN,20338,20345,8
boat in a turmoil of foam there was,8,NPDNPNNV,20342,20349,8
mind unused to the sea,5,NVPDN,20361,20365,5
sea would have concluded,4,NVVV,20365,20368,4
dingey could ascend these sheer heights in time,8,NVVDANPN,20371,20378,8
shore was still,3,NVM,20380,20382,3
oiler was,2,NV,20385,20386,2
surfman boys he said swiftly she,6,ANNVMN,20389,20394,6
she wo n't live three minutes,6,NVMVAN,20394,20399,6
we re too far out to swim,7,NVMMPPN,20402,20408,7
swim shall i,3,NVN,20408,20410,3
i take her to sea,5,NVNPN,20410,20414,5
her to sea again captain,5,NPNMV,20412,20416,5
go ahead said the captain,5,VMVDN,20418,20422,5
steady oarsmanship turned the boat in the middle,8,ANVDNPDN,20434,20441,8
took her,2,VN,20446,20447,2
there was a considerable silence as the boat,8,NVDANPDN,20452,20459,8
considerable silence as the boat bumped,6,ANPDNV,20455,20460,6
boat bumped over the furrowed sea,6,NVPDAN,20459,20464,6
bumped over the furrowed sea to deeper water,8,VPDANPAN,20460,20467,8
somebody in gloom spoke well anyhow they,7,NPNVMMN,20469,20475,7
they must have seen us from the shore,8,NVVVNPDN,20475,20482,8
gulls went,2,NV,20486,20487,2
slanting flight up the wind toward the grey,8,VNPDNPDN,20489,20496,8
squall marked by dingy clouds,5,NVPNN,20500,20504,5
clouds brick red like smoke,5,NVMPN,20506,20510,5
burning building,2,VN,20513,20514,2
building appeared from the south,5,NVPDN,20514,20518,5
what do you,3,NVN,20520,20522,3
you think of those life,5,NVPDN,20522,20526,5
life saving people,3,NVN,20526,20528,3
people ai n't they peaches funny they,7,NVMNNAN,20528,20534,7
they peaches funny they have n't seen us,8,NNANVMVN,20531,20538,8
they think we,3,NVN,20540,20542,3
we re out here for sport,6,NVMMPN,20542,20547,6
they think we,3,NVN,20549,20551,3
we re fishin maybe they,5,NVMMN,20551,20555,5
they think we,3,NVN,20555,20557,3
we re damned fools it,5,NVVNN,20557,20561,5
fools it was a long afternoon,6,NNVDAN,20560,20565,6
changed tide,2,VN,20567,20568,2
tide tried to force them southward,6,NVMVNN,20568,20573,6
wave said northward far ahead where coast line,8,NVMMMMAN,20577,20584,8
said northward far ahead where coast line sea,8,VMMMMANN,20578,20585,8
sky formed their mighty angle there,6,NVNNNN,20587,20592,6
their mighty angle there were little dots which,8,NNNNVANN,20589,20596,8
little dots which seemed to indicate a city,8,ANNVMVDN,20594,20601,8
seemed to indicate a city on the shore,8,VMVDNPDN,20597,20604,8
to indicate a city on the shore st,8,MVDNPDNN,20598,20605,8
indicate a city on the shore st augustine,8,VDNPDNNN,20599,20606,8
captain shook his head,4,NVNN,20608,20611,4
oiler rowed,2,NV,20618,20619,2
correspondent rowed then the oiler,5,NVMDN,20623,20627,5
oiler rowed it,3,NVN,20627,20629,3
it was a weary business,5,NVDAN,20629,20633,5
human back can become the seat,6,ANVVDN,20635,20640,6
back can become the seat of more aches,8,NVVDNPAN,20636,20643,8
are registered in books for the composite anatomy,8,VVPNPDAN,20647,20654,8
composite anatomy of a regiment it is,7,ANPDNNV,20653,20659,7
regiment it is a limited area,6,NNVDAN,20657,20662,6
it can become the theatre,5,NVVDN,20664,20668,5
can become the theatre of innumerable muscular conflicts,8,VVDNPAAN,20665,20672,8
become the theatre of innumerable muscular conflicts tangles,8,VDNPAANN,20666,20673,8
other comforts did you,4,ANVN,20677,20680,4
you ever like to row billie,6,NMVMVN,20680,20685,6
billie asked the correspondent,4,NVDN,20685,20688,4
correspondent no said the oiler,5,NMVDN,20688,20692,5
oiler hang it,3,NVN,20692,20694,3
rowing seat for a place in the bottom,8,VNPDNPDN,20699,20706,8
bottom of the boat he suffered,6,NPDNNV,20706,20711,6
boat he suffered a bodily depression that,7,NNVDANN,20709,20715,7
bodily depression that caused him,5,ANNVN,20713,20717,5
him to be,3,NMV,20717,20719,3
everything save an obligation to wiggle one finger,8,NPDNMVAN,20722,20729,8
obligation to wiggle one finger there,6,NMVANN,20725,20730,6
one finger there was cold sea water,7,ANNVANN,20728,20734,7
cold sea water swashing,4,ANNV,20732,20735,4
he lay in it his head,6,NVPNNN,20743,20748,6
it his head pillowed on a thwart,7,NNNVPDN,20746,20752,7
thwart was within an inch of the swirl,8,NVPDNPDN,20752,20759,8
obstreperous sea came in board,5,ANVPN,20768,20772,5
drenched him,2,VN,20774,20775,2
matters did not annoy him it,6,NVMVNN,20780,20785,6
him it is almost,4,NNVM,20784,20787,4
